id,created_at,screen_name,source,clean_text,original_text,is_retweet,favorite_count,retweet_count,hashtags,urls,mentions,city,province,longitude,latitude
1247882810725027846,Wed Apr 08 13:43:41 +0000 2020,Shauna_MacNeil,Twitter for iPhone,"['rickconrad', 'single', 'parent', 'parent', 'widow', 'widower', 'many', 'small', 'child', 'grandparent', 'caregiver', 'risk', 'stress', 'parent', 'pandemic', 'unbelievably', 'hard']","@rickconrad Because there are single parents, only parents, widows and widowers and many have small children. We can’t put grandparents and other caregivers at risk.  The stress of being an only parent during a  pandemic is unbelievably hard.",False,0,0,,['https://twitter.com/i/web/status/1247882810725027846'],['rickconrad'],Halifax,Nova Scotia,-63.57239,44.64533
1247881875332497408,Wed Apr 08 13:39:58 +0000 2020,FreethinkRadio,Twitter Web App,"['march', '14th', 'post', 'covid-19', 'hoax', 'anti-socialism', 'rant', 'april', 'die', 'covid-19', 'family', 'ask', 'gofundme', 'donation', 'post', 'mock', 'karen', 'kolb', 'sehlke', 'death', 'underscore', 'tragic', 'risk', 'take', 'take', 'pandemic', 'grant', 'staysafe']","March 14th: *posted COVID-19 hoax, anti-socialism rant on FB*

April 2nd: *died of COVID-19, family asking for GoFundMe donations*

I post this not to mock Karen Kolb Sehlke's death, but to underscore the tragic risk one takes when taking this pandemic for granted. #RIP #StaySafe https://t.co/MAKYAYVyGx",True,0,0,,,['sunnmcheaux'],,,-113.64258,60.10867
1247881452525518848,Wed Apr 08 13:38:17 +0000 2020,WsMum2013,Twitter for iPhone,"['half', 'world', 'child', 'school', 'pandemic', 'expert', 'risk', 'kid', 'spend', 'time', 'internet']","With half the world’s children now out of school because of the pandemic, experts say there are new risks for kids who are now spending more time on the internet.

https://t.co/tFvsKdvi47",True,0,0,,,['globalnews'],,,-113.64258,60.10867
1247881325341822976,Wed Apr 08 13:37:47 +0000 2020,aliciaxo85,Twitter for iPhone,"['reminder', 'is/was', 'important', 'child', 'care', 'program', 'guideline', 'practice', 'specific', 'covod-19', 'place', 'provincial', 'government', 'well', 'others', 'fredericton', 'daycare', 'confirm', 'case', 'covid-19', 'news']","A reminder why it is/was so important for child care programs to have guidelines and practices, specific to COVOD-19 in place. Some provincial governments did well on this, others...........Fredericton daycare has confirmed case of COVID-19 | CBC News https://t.co/96vJ13iPO5",True,0,0,,,['CCCF_FCSGE'],,Prince Edward Island,-62.99868,46.50011
1247881056126218240,Wed Apr 08 13:36:42 +0000 2020,CPraillGlobal,TweetDeck,"['half', 'world', 'child', 'school', 'pandemic', 'expert', 'risk', 'kid', 'spend', 'time', 'internet']","With half the world’s children now out of school because of the pandemic, experts say there are new risks for kids who are now spending more time on the internet.

https://t.co/tFvsKdvi47",True,0,0,,,['globalnews'],Regina,Saskatchewan,-104.6178,50.45008
1247880615422316544,Wed Apr 08 13:34:57 +0000 2020,jhsscc_morris,Twitter for iPhone,"['whether', 'provide', 'emergency', 'care', 'sideline', 'pandemic', 'childcare', 'educator', 'need', 'protection', 'good', 'remuneration', 'respect', 'must', 'stop', 'rely', 'assume', 'great', 'responsibility', 'without', 'sufficient', 'preparation', 'support', 'reward']","Whether  providing emergency care or sidelined by the pandemic, childcare educators need protection, better remuneration, &amp; more respect. We must stop relying on them to assume great responsibility without sufficient preparation, support, or reward. https://t.co/tYe83MEu7M",True,0,0,,,['susanprentice'],Winnipeg,Manitoba,-97.14704,49.8844
1247879752444268544,Wed Apr 08 13:31:32 +0000 2020,LatinoLdnOnt,Hootsuite Inc.,"['support', 'family', 'learn', 'funding', 'family', 'apply', 'child', 'school', 'child', 'care', 'coronavirus', 'covid-19', 'find', 'eligible', 'apply']",Get support for families - Learn about funding that families can apply for if they have children who are not in school or child care because of coronavirus (COVID-19). Find out if you are eligible and how to apply https://t.co/ck1Q421v0g,False,0,0,,['https://twitter.com/i/web/status/1247879752444268544'],,London,Ontario,-81.23304,42.98339
1247879747356577792,Wed Apr 08 13:31:30 +0000 2020,IAFFLocal1075,Twitter for Android,"['sorry', 'hear', 'member', 'pass', 'condolence', 'local', 'family', 'friend', 'safe', 'pandemic', 'brother', 'sister', 'brother']","Sorry to hear of your members passing. Our condolences to Local 2, family and friends. Be safe during this pandemic brothers and sisters. RIP brother https://t.co/x6FXqlbWfY",False,0,0,,['https://twitter.com/i/web/status/1247879747356577792'],,St. John's,Newfoundland and Labrador,-52.70931,47.56494
1247879631673405441,Wed Apr 08 13:31:03 +0000 2020,GVaisson,Twitter for Android,"['socialdistancing', 'physicaldistancing', 'help', 'keep', 'community', 'safe', 'coronavirus', 'covid_19', 'covid19', '5-minute', 'digitalhealth', 'application', 'build', 'avatar', 'share', 'friend', 'family', 'covid19canada']","How does #SocialDistancing #PhysicalDistancing help keep your community safe from the #Coronavirus #Covid_19 #Covid19? A 5-minute #DigitalHealth application. Build your own avatars and see, and share with your friends &amp; family! #Covid19Canada https://t.co/yECcjZToIG",True,0,0,"['SocialDistancing', 'PhysicalDistancing', 'Coronavirus', 'Covid_19', 'Covid19']",,['wittemanlab'],,,-113.64258,60.10867
1247878347637641218,Wed Apr 08 13:25:57 +0000 2020,KarinProulx,Twitter for Android,"['well', 'say', 'joelwestheimer', 'word', 'crisis', 'character', 'danger', 'character', 'opportunity', 'miss', 'opportunity', 'spend', 'time', 'family', 'whatever', 'form', 'family', 'take', 'household']","Well said @joelwestheimer In the word “crisis”: ""One is the character for “danger” and the other the character for “opportunity.” (...) we’re missing out on the opportunity: to spend time as families (in whatever form that family takes in your household).""
https://t.co/Dpd3Qhbm6D",False,0,0,,['https://twitter.com/i/web/status/1247878347637641218'],['joelwestheimer'],Ottawa,Ontario,-75.69812,45.41117
1247878101352288256,Wed Apr 08 13:24:58 +0000 2020,MehakS23,Twitter Web App,"['covid19', 'impact', 'life', 'billion', 'globally', 'billion', 'child', 'currently', 'school', 'girl', 'suffer', 'closure', 'unesco', 'abalbrectsen', 'fast', 'school', 'close']","#COVID19 is impacting the lives of billions globally with over 1.5 BILLION children currently out of school - ""and it is girls who will suffer most from the closures"" 
@UNESCO @ABAlbrectsen

Here's how fast schools closed 👇

https://t.co/9fYQtdr25w https://t.co/Pm2UYs7Md3",True,0,0,['COVID19'],,['PlanGlobal'],Toronto,Ontario,-79.4163,43.70011
1247877473963999233,Wed Apr 08 13:22:28 +0000 2020,Restartjobs,Buffer,"['financial', 'support', 'available', 'family', 'child', 'longer', 'attend', 'school', 'child', 'care', 'centre', 'covid-19', 'apply', 'online', 'today', 'newjobnewbeginnings', 'covid19', 'financialsupport', 'ontario']","$$$ Financial support available to families with children who can no longer attend school or a child care centre due to COVID-19. Apply online today!

https://t.co/3NvAcTppXK

#NewJobNewBeginnings #COVID19 #Financialsupport #ontario #ygk https://t.co/xpwvveUMWM",False,0,0,,['https://twitter.com/i/web/status/1247877473963999233'],,Kingston,Ontario,-76.48098,44.22976
1247877072531476480,Wed Apr 08 13:20:53 +0000 2020,InnovateGuelph,Twitter Web App,"['wish', 'family', 'happy', 'healthy', 'passover', 'stayhome', 'stay', 'safe', 'call', 'video', 'chat', 'family', 'person', 'thank', 'part', 'slow', 'spread', 'covid19guelph']","Wishing you and your family a happy, healthy Passover. #Stayhome stay safe. Call or video chat with family who can't be with you in person. Thank you for doing your part to slow the spread of #COVID19Guelph https://t.co/nY7Iw0ZURw https://t.co/KxshMuKO5s",True,0,0,['Stayhome'],,['cityofguelph'],Guelph,Ontario,-80.24967,43.5501
1247876939341279239,Wed Apr 08 13:20:21 +0000 2020,cityofguelph,Hootsuite Inc.,"['wish', 'family', 'happy', 'healthy', 'passover', 'stayhome', 'stay', 'safe', 'call', 'video', 'chat', 'family', 'person', 'thank', 'part', 'slow', 'spread', 'covid19guelph']","Wishing you and your family a happy, healthy Passover. #Stayhome stay safe. Call or video chat with family who can't be with you in person. Thank you for doing your part to slow the spread of #COVID19Guelph https://t.co/nY7Iw0ZURw https://t.co/KxshMuKO5s",False,8,4,['Stayhome'],['https://twitter.com/i/web/status/1247876939341279239'],,Guelph,Ontario,-80.24967,43.5501
1247874344224784385,Wed Apr 08 13:10:02 +0000 2020,hfxwordy,Twitter Web App,"['parent', 'child', 'disability', 'reality', 'past', 'year', 'wonder', 'pandemic', 'help', 'understand', 'change', 'workplaces', 'support', 'parent', 'falsely', 'compartmentalize', 'work/home/school', 'life']","As a parent of a child with a disability, this has been my reality for the past 6 years. I wonder if the pandemic will help ppl understand &amp; change the way workplaces support parents, &amp; they way we falsely try to compartmentalize work/home/school life? https://t.co/mcHtlv1Hqg",False,4,0,,['https://twitter.com/i/web/status/1247874344224784385'],,Halifax,Nova Scotia,-63.57239,44.64533
1247873243983368192,Wed Apr 08 13:05:40 +0000 2020,HelloCanada,Twitter Web App,"['replicate', 'school', 'home', 'expect', 'parent', 'teacher', 'say', 'yorkueducation', 'assistant', 'prof', 'vidya', 'shah', 'vidyashah6', 'hellocanada', 'covid19']","We can’t replicate school at home so we shouldn’t expect parents to be teachers, says @YorkUeducation Assistant Prof Vidya Shah @VidyaShah6 https://t.co/CiA2yfHlxn via @HelloCanada #COVID19",True,0,0,,,"['YorkUnews', 'YorkUeducation']",,,-113.64258,60.10867
1247871869841276929,Wed Apr 08 13:00:12 +0000 2020,MadameAPurdy,Twitter for iPhone,"['back', 'school', 'many', 'today', 'morning', 'purdy', 'girl', 'work', 'hard', 'word', 'work', 'reading', 'pattern', 'maybe', 'sneak', 'froot', 'loop', 'nobody', 'watching', 'backtoschool', 'watchuslearn', 'tcrce']","It’s “back to school” for many of us today. This morning, the Purdy girls are working hard on word work, reading, patterns... and maybe sneaking in a few Froot Loops when nobody’s watching :) #backtoschool #watchuslearn #tcrce https://t.co/fna0t8KcPA",False,4,0,,['https://twitter.com/i/web/status/1247871869841276929'],,,Nova Scotia,-62.99865,45.00015
1247869836555956229,Wed Apr 08 12:52:07 +0000 2020,sleepycovetales,Twitter for iPhone,"['good', 'morning', 'lovely', 'back', 'work', 'today', 'know', 'everyone', 'miss', 'family', 'please', 'huge', 'favour', 'stayhome', 'wknd', 'safe', 'spread', 'virus', 'care', 'protectthevulnerable', 'staysafe', 'dontvisitnan']",Good morning my lovelies!! I’m back to work today I know everyone is missing family but Please do me the hugest favour #stayhome this wknd so I can be safe &amp; not spread this virus to those I have to care for #protectthevulnerable #staysafe #DontvisitNan,False,7,0,,['https://twitter.com/i/web/status/1247869836555956229'],,,Newfoundland and Labrador,-56.0,52.0
1247868651958657024,Wed Apr 08 12:47:25 +0000 2020,helenjwc,Twitter for iPhone,"['four', 'excellent', 'site', 'cover', 'math', 'age', '3-11', 'please', 'mrmattock', 'ajmagicmessage', 'mrbartonmaths', 'michaelollerton', 'accomplishedu']","2. Here are four excellent sites covering #maths for ages 3-11:
https://t.co/2OxLoI1OJA 

https://t.co/CvzTQ4OLnW

https://t.co/ttD9AmLAz2

https://t.co/1ZIKL9ZQMV

Please RT @mrmattock @AJMagicMessage @mrbartonmaths @MichaelOllerton @AccomplishEdu",True,0,0,['maths'],"['https://nrich.maths.org/14600', 'https://www.babcockldp.co.uk/campaigns/coronavirus-support-for-schools-parents-and-pupils/links-for-home-schooling-resources-and-activities/mathematics']",['helenjwc'],St Ives,England,-5.4875,50.20861
1247868452947271680,Wed Apr 08 12:46:38 +0000 2020,zbpipe,TweetDeck,"['first', 'covid-19', 'school', 'dreami', 'school', 'student', 'hand', 'parent', 'write', 'note', 'indicate', 'child', 'test', 'positive', 'covid', 'feel', 'fine', 'send', 'school', 'dream', 'play', 'tell', 'back', 'room', 'keep', 'recess']","Had my first Covid-19 School Dream.I was at school and a student handed me a parent written note indicating the child  tested positive for Covid, but they feel fine so they sent him to school .The dream played on.I was told to put kid in back of room and keep them in for recess.",False,2,1,,['https://twitter.com/i/web/status/1247868452947271680'],,Hamilton,Ontario,-79.84963,43.25011
1247866653578321920,Wed Apr 08 12:39:29 +0000 2020,weirunlearning,Twitter Web App,"['replicate', 'school', 'home', 'expect', 'parent', 'teacher', 'say', 'yorkueducation', 'assistant', 'prof', 'vidya', 'shah', 'vidyashah6', 'hellocanada', 'covid19']","We can’t replicate school at home so we shouldn’t expect parents to be teachers, says @YorkUeducation Assistant Prof Vidya Shah @VidyaShah6 https://t.co/CiA2yfHlxn via @HelloCanada #COVID19",True,0,0,,,"['YorkUnews', 'YorkUeducation']",Toronto,Ontario,-79.4163,43.70011
1247865736976097280,Wed Apr 08 12:35:50 +0000 2020,VidyaShah6,Twitter Web App,"['replicate', 'school', 'home', 'expect', 'parent', 'teacher', 'say', 'yorkueducation', 'assistant', 'prof', 'vidya', 'shah', 'vidyashah6', 'hellocanada', 'covid19']","We can’t replicate school at home so we shouldn’t expect parents to be teachers, says @YorkUeducation Assistant Prof Vidya Shah @VidyaShah6 https://t.co/CiA2yfHlxn via @HelloCanada #COVID19",True,0,0,,,"['YorkUnews', 'YorkUeducation']",Toronto,Ontario,-79.4163,43.70011
1247864367586127878,Wed Apr 08 12:30:24 +0000 2020,unlearn_com,Hootsuite Inc.,"['family', 'ohio', 'come', 'creative', 'safely', 'socialize', 'member', 'neighbourhood', 'hold', 'drive', 'thru', 'chat', 'unlearn', 'socialdistancing', 'pandemic']",A Family in Ohio has come up with a creative way to safely socialize with members in their neighbourhood by holding a “drive thru chat”. #unlearn #socialdistancing #pandemic https://t.co/JELr23Pe3G,False,2,0,,['https://twitter.com/i/web/status/1247864367586127878'],,,,-113.64258,60.10867
1247864276498501634,Wed Apr 08 12:30:02 +0000 2020,YorkUnews,Sprout Social,"['replicate', 'school', 'home', 'expect', 'parent', 'teacher', 'say', 'yorkueducation', 'assistant', 'prof', 'vidya', 'shah', 'vidyashah6', 'hellocanada', 'covid19']","We can’t replicate school at home so we shouldn’t expect parents to be teachers, says @YorkUeducation Assistant Prof Vidya Shah @VidyaShah6 https://t.co/CiA2yfHlxn via @HelloCanada #COVID19",False,8,6,,['https://twitter.com/i/web/status/1247864276498501634'],['YorkUeducation'],Toronto,Ontario,-79.4163,43.70011
1247863874277093377,Wed Apr 08 12:28:26 +0000 2020,BobDowbiggin,Twitter for iPhone,"['move', 'story', 'angel', 'marino', 'certified', 'medical', 'assistant', 'mother', 'drop', 'child', 'brighthorizons', 'childcare', 'hubs', 'firstrespondersfirst', 'initiative', 'fund']","Moving story from Angel Marino, a certified medical assistant mother who drops her child at one of the @brighthorizons childcare hubs our #FirstRespondersFirst initiative is funding.  https://t.co/jNESdDCzsP",True,0,0,,,"['ariannahuff', 'BrightHorizons']",Vancouver,British Columbia,-123.11934,49.24966
1247862427586265096,Wed Apr 08 12:22:41 +0000 2020,ShireenJ,Echofon,"['many', 'old', 'family', 'member', 'risk', 'coronavirus', 'covid19', 'life', 'danger', 'meet', 'people', 'outside', 'household', 'anyone', 'anyone', 'spread']","Many of us have older family members who are at risk from coronavirus (#COVID19) ⚠️

DO NOT put their lives in danger by meeting with people outside of your household 🏠

Anyone can get it, anyone can spread it. https://t.co/Chaa8h7b2U",True,0,0,['COVID19'],,['DHSCgovuk'],Toronto,Ontario,-79.4163,43.70011
1247862226742116353,Wed Apr 08 12:21:53 +0000 2020,MsAniskoClutton,Twitter Web App,"['change', 'routine', 'challenge', 'eastersealschi', 'create', 'free', 'toolkit', 'support', 'child', 'autism', 'coronavirus', 'school', 'closure', 'include', 'schedule', 'activity', 'check', 'covid19', 'corona']",Changes in routine can be challenging. @EastersealsChi has created a free toolkit to support children with autism through Coronavirus school closures. It includes schedules and other activities. Go check them out here 👉 https://t.co/saIdgO5LTs #covid19 #corona https://t.co/cGO7F04sGp,True,0,0,,,"['TobiiDynavox', 'EastersealsChi']",Hamilton,Ontario,-79.84963,43.25011
1247860181867704320,Wed Apr 08 12:13:46 +0000 2020,nattuurlijk,Twitter Web App,"['illegals', 'put', 'family', 'family', 'loved', 'one', 'serious', 'risk', 'killer', 'covid-19', 'right', 'must', 'return', 'immediately', 'mailonline']","These illegals are putting me, my family, you, you're family, your loved ones at serious risk from the killer COVID-19. 
👇
THE DO NOT HAVE THE RIGHT TO DO THIS.

THEY MUST BE RETURNED IMMEDIATELY, THERE AND THEN.

https://t.co/nZUrCF9Psy via @MailOnline",True,0,0,,,['Eric_Chitt'],,,-113.64258,60.10867
1247860133960601606,Wed Apr 08 12:13:34 +0000 2020,DavidAdeola,Twitter for iPhone,"['kay_musungay', 'keep', 'hope', 'child', 'keep', 'safe', 'lockdown']",@Kay_Musungay How are you keeping? Hope you and the children are keeping safe. Is there a lockdown in SA?,False,1,0,,,['Kay_Musungay'],Surrey,British Columbia,-122.82509,49.10635
1247859303895064579,Wed Apr 08 12:10:16 +0000 2020,stephenjez,Twitter for iPhone,"['child', 'miss', 'daily', 'interaction', 'safe', 'structured', 'routined', 'way', 'help', 'maintain', 'relationship', 'connectedness', 'covid19', 'way', 'maintain', 'relationship', 'school', 'closure', 'edutopia']","Some children are missing daily interactions that are safe, structured and routined. Here are some ways to help maintain those relationships! #connectedness #Covid19 #sel 7 Ways to Maintain Relationships During Your School Closure | Edutopia https://t.co/U33ZHeuaf8",False,1,0,,['https://twitter.com/i/web/status/1247859303895064579'],,Calgary,Alberta,-114.08529,51.05011
1247857512579084290,Wed Apr 08 12:03:09 +0000 2020,StephaniedeJag3,Twitter for iPhone,"['mkill', 'cannabis', 'help', 'somewhat', 'normal', 'life', 'without', 'comatose', 'drug', 'extremely', 'well', 'know', 'hygiene', 'anything', 'death', 'virus', 'high', 'risk', 'die', 'poor', 'parent', 'family']","@mkill The cannabis helped her have a somewhat normal life without being comatose by all the drugs she was on. And she was doing extremely well. I don’t know how “Hygiene” had anything to do with her death, she got the virus, and being high risk, she died. Her poor parents and family 😞",False,2,0,,['https://twitter.com/i/web/status/1247857512579084290'],['mkill'],Revelstoke,British Columbia,-118.2023,50.98317
1247856934901907456,Wed Apr 08 12:00:51 +0000 2020,UniforWomen,Twitter for iPad,"['childcare', 'surge', 'issue', 'pandemic']",Childcare surges as an issue during the pandemic.  https://t.co/UY0ELJrkTQ,True,0,0,,['https://www.citylab.com/life/2020/04/coronavirus-daycare-essential-workers-parents-child-care/608605/'],['susanprentice'],Toronto,Ontario,-79.4163,43.70011
1247856777913405441,Wed Apr 08 12:00:14 +0000 2020,MaGuindi,Twitter for iPad,"['children/youth', 'already', 'impact', 'armed', 'conflict', 'displacement', 'disaster', 'high', 'risk', 'covid19', 'educannotwait', 'appeal', 'donor', 'funding', 'respond', 'coronavirus', 'pandemic-related', 'education', 'crisis', 'need', 'danishmfa', 'noradmfa', 'dutchmfa', 'dfid_uk']","Children/youth already impacted by armed conflict, displacement &amp; disasters are at high risk of #covid19!

@EduCannotWait appeals to donors for $50M in new funding to respond to #coronavirus pandemic-related &amp; other education crisis needs.

@danishmfa @noradmfa @dutchmfa @dfid_uk https://t.co/fBhTCLHqXK",True,0,0,['covid19'],,"['KentPage', 'EduCannotWait']",Ottawa,Ontario,-75.69812,45.41117
1247856637756440577,Wed Apr 08 11:59:41 +0000 2020,MUN_Engineering,Twitter Web App,"['student', 'wonder', 'financial', 'support', 'canadian', 'government', 'beyond', 'cerb', 'file', 'return', '2018', 'gst/hst', 'rebate', 'normally', 'receive', 'bump', 'distribute', 'april', 'memorial_intl', 'memorialu']","To our students wondering about financial supports from the Canadian government (beyond the CERB), if you filed a tax return in 2018, the GST/HST rebate you normally receive will be bumped up. It will be distributed April 9: https://t.co/v377V5HA9v @Memorial_INTL @MemorialU",True,0,0,,,['SonjaEKnutson'],St. John's,Newfoundland and Labrador,-52.70931,47.56494
1247856121299316745,Wed Apr 08 11:57:38 +0000 2020,Bill_Zebedee,Twitter Web App,"['like', 'watch', 'story', 'news', 'income', 'family', 'deal', 'feed', 'pandemic', 'every', 'time', 'story', 'seem', 'middle', 'class', 'home', 'disadvantage', 'suffer', 'sometimes', 'even']","Just once, I'd like to watch a story on the news about how a low income family is dealing with feeding themselves during this pandemic. Every time I see a story it seems set in a middle class home. Disadvantaged are suffering too, sometimes even more.",False,1,0,,['https://twitter.com/i/web/status/1247856121299316745'],,Dartmouth,Nova Scotia,-63.57719,44.67134
1247855487560945666,Wed Apr 08 11:55:06 +0000 2020,MediaplanetCA,Hootsuite Inc.,"['spread', 'covid-19', 'million', 'canadian', 'child', 'affect', 'food', 'insecurity', 'current', 'crisis', 'put', 'even', 'pressure', 'family', 'child', 'learn', 'help', 'breakfastcanada']","""Before the spread of #COVID-19, more than 1 million #Canadian children were affected by food insecurity. Now, the current crisis is putting even more pressure on the families of these children."" Learn how you can help with @BreakfastCanada here: https://t.co/PwylB7gn0R 🍳",False,2,2,"['COVID', 'Canadian']",['https://twitter.com/i/web/status/1247855487560945666'],,Toronto,Ontario,-79.4163,43.70011
1247855035272384512,Wed Apr 08 11:53:19 +0000 2020,sungmanitu2020,Twitter for Android,"['teacher', 'school', 'little', 'heart', 'give', 'lesson', 'without', 'student', 'attend', 'must', 'wary', 'coruna', 'virus', 'send', 'lesson', 'video', 'child', 'follow']",Teachers in our school Little hearts give lessons without students attending. We must be wary of Coruna virus. We will send lessons video to our children and follow them.👍👍👍 https://t.co/raKAMHRn8i,True,0,0,,,['Omar18544048'],,,-113.64258,60.10867
1247853456045596673,Wed Apr 08 11:47:02 +0000 2020,meggiewalk,Twitter for iPhone,"['child', 'use', 'school', 'away', 'home', 'number', 'call', 'get', 'number', 'plea', 'get', 'increase', 'child', 'home', 'covid19', 'ldnont', 'justintrudeau']","“Children used to go to school to get away from it. But now they’re at home. The number of calls we are getting, the number of pleas we are getting are increasing from children at home.” #COVID19 #ldnont @JustinTrudeau https://t.co/Clp3Zanl8R",False,4,7,,['https://twitter.com/i/web/status/1247853456045596673'],,London,Ontario,-81.23304,42.98339
1247853327976665090,Wed Apr 08 11:46:32 +0000 2020,trusssssmidaddy,Twitter for iPhone,"['louise', 'wait', 'close', 'school', 'virus', 'completely', 'go', 'cackle', 'hand', 'virus', 'tina', 'nervously', 'maybe', 'stay', 'inside', 'time', 'start', 'family', 'band', 'call', 'quaran-tinas']","Louise: “So wait, they’re closing school until this virus is completely gone? *cackling* Oh I gotta get my hands on more of this virus.”

Tina: *nervously* “Maybe we should all stay inside. We can use this time to start a family band. We can call them the Quaran-Tinas.”",True,0,0,,,['jonmarkland'],Toronto,Ontario,-79.4163,43.70011
1247853270493732865,Wed Apr 08 11:46:18 +0000 2020,AndrewT60052495,Twitter for iPad,"['many', 'old', 'family', 'member', 'risk', 'coronavirus', 'covid19', 'life', 'danger', 'meet', 'people', 'outside', 'household', 'anyone', 'anyone', 'spread']","Many of us have older family members who are at risk from coronavirus (#COVID19) ⚠️

DO NOT put their lives in danger by meeting with people outside of your household 🏠

Anyone can get it, anyone can spread it. https://t.co/Chaa8h7b2U",True,0,0,['COVID19'],,['DHSCgovuk'],Halifax,Nova Scotia,-63.57239,44.64533
1247853157453107203,Wed Apr 08 11:45:51 +0000 2020,wlmurphy_mb,Twitter for Android,"['whether', 'provide', 'emergency', 'care', 'sideline', 'pandemic', 'childcare', 'educator', 'need', 'protection', 'good', 'remuneration', 'respect', 'must', 'stop', 'rely', 'assume', 'great', 'responsibility', 'without', 'sufficient', 'preparation', 'support', 'reward']","Whether  providing emergency care or sidelined by the pandemic, childcare educators need protection, better remuneration, &amp; more respect. We must stop relying on them to assume great responsibility without sufficient preparation, support, or reward. https://t.co/tYe83MEu7M",True,0,0,,,['susanprentice'],Winnipeg,Manitoba,-97.14704,49.8844
1247852763410771970,Wed Apr 08 11:44:17 +0000 2020,lindabintoronto,Twitter for Android,"['online', 'threat', 'also', 'compound', 'rise', 'instance', 'physical', 'sexual', 'abuse', 'child', 'expose', 'within', 'home', 'shuttered', 'school', 'social', 'distancing']",The new online threats are also being compounded by the rising instances of physical and sexual abuse that some children are now exposed to within their own homes because of shuttered schools and social distancing. https://t.co/YfldAbIKfC,True,0,0,,,['CityNews'],Toronto,Ontario,-79.4163,43.70011
