id,created_at,screen_name,source,clean_text,original_text,is_retweet,favorite_count,retweet_count,hashtags,urls,mentions,city,province,longitude,latitude
1247921758897930241,Wed Apr 08 16:18:27 +0000 2020,rod_alive,Twitter for iPad,"['release', 'inmate', 'decrease', 'risk', 'spread', 'inside', 'outside', 'csc_scc_en', 'include', 'brother', 'guard', 'family', 'cdnhealth', 'doctor', 'urge', 'government', 'release', 'many', 'inmate', 'possible', 'amid', 'covid', 'globe', 'mail']","Releasing inmates will decrease the risk of spread inside &amp; outside ⁦@CSC_SCC_en⁩ including my brother ⁦a Guard &amp; his family #cdnhealth 1/2 
Doctors  urge governments to release as many inmates as possible amid COVID - The Globe and Mail https://t.co/4Bd613hO0l",False,2,0,,['https://twitter.com/i/web/status/1247921758897930241'],['CSC_SCC_en'],Halifax,Nova Scotia,-63.57239,44.64533
1247921615196655616,Wed Apr 08 16:17:52 +0000 2020,C19Collective,Twitter Web App,"['great', 'question', 'know', 'old', 'people', 'much', 'high', 'risk', 'die', 'covid', 'take', 'risk', 'keep', 'grandparent', 'extend', 'family', 'safe', 'zoom', 'visit']",Great question -- we know that older people are at much higher risk of dying from COVID so don't take the risk. Keep your grandparents and extended family safe and do a Zoom visit for now https://t.co/AfjmZZMOIO,False,1,0,,['https://twitter.com/i/web/status/1247921615196655616'],,,,-113.64258,60.10867
1247921210287063041,Wed Apr 08 16:16:16 +0000 2020,Michell10534404,Twitter for Android,"['work', 'home', 'covid-19', 'important', 'keep', 'safety', 'mind', 'follow', 'electrical', 'safety', 'tip', 'keep', 'family', 'home', 'safe', 'electrical', 'hazard']","Working from home because of COVID-19? If so, it is important to keep safety in mind. Follow these electrical safety tips to keep you, your family and your home safe from electrical hazards: https://t.co/POc8o2Mn98 https://t.co/F6hwm2m1Pf",True,0,0,,,['WhitbyFire'],Hamilton,Ontario,-79.84963,43.25011
1247921152669790208,Wed Apr 08 16:16:02 +0000 2020,riverninja12R,Twitter for Android,"['alberta', 'longer', 'follow', 'flawed', 'casual', 'meander', 'federal', 'policy', 'theresa', 'coronavirus', 'jkenney', 'chart', 'strategy', 'base', 'work', 'asia', 'slow', 'spread', 'kid', 'school', 'people', 'back', 'work', 'ableg', 'cdnpoli']","Alberta will no longer follow the flawed, casual &amp; meandering federal policies of Dr. Theresa Tam on coronavirus.

@jkenney charts new strategy based on what worked in Asia to slow the spread, get kids in school &amp; people back to work.

#ableg #cdnpoli 

https://t.co/hViAQ7eh7t https://t.co/iIuIRuNzr5",True,0,0,,,['DavidStaplesYEG'],,Alberta,-117.469,52.28333
1247919712106942464,Wed Apr 08 16:10:19 +0000 2020,MinutemanHam,Twitter for iPhone,"['thank', 'teacher', 'proud', 'support', 'educator', 'continue', 'give', 'child', 'chance', 'learn', 'grow', 'stay', 'safe', 'know', 'need', 'anything', 'minutemanpress', 'inthistogether', 'covid19', 'coronavirus']",THANK YOU TEACHERS! We are PROUD to support educators who continue to give our children a chance to learn and grow! STAY SAFE! Let us know if you need anything! #MinutemanPress #InThisTogether #Covid19 #Coronavirus https://t.co/CR9yIejoXW,False,1,1,,['https://twitter.com/i/web/status/1247919712106942464'],,Hamilton,Ontario,-79.84963,43.25011
1247919629076320257,Wed Apr 08 16:09:59 +0000 2020,Harv2000,Twitter for Android,"['alberta', 'longer', 'follow', 'flawed', 'casual', 'meander', 'federal', 'policy', 'theresa', 'coronavirus', 'jkenney', 'chart', 'strategy', 'base', 'work', 'asia', 'slow', 'spread', 'kid', 'school', 'people', 'back', 'work', 'ableg', 'cdnpoli']","Alberta will no longer follow the flawed, casual &amp; meandering federal policies of Dr. Theresa Tam on coronavirus.

@jkenney charts new strategy based on what worked in Asia to slow the spread, get kids in school &amp; people back to work.

#ableg #cdnpoli 

https://t.co/hViAQ7eh7t https://t.co/iIuIRuNzr5",True,0,0,,,['DavidStaplesYEG'],Calgary,Alberta,-114.08529,51.05011
1247918613584994304,Wed Apr 08 16:05:57 +0000 2020,HoganBCMJ,Twitter Web App,"['jruemper', 'tough', 'case', 'elderly', 'family', 'member', 'live', 'child', 'element', 'increase', 'risk', 'take', 'precedent', 'best', 'interest', 'child', 'give', 'covid-19', 'grandparent', 'great-grandparent']",@jruemper It's all so tough.  In this case there were elderly family members living with the children.  That's the element of increased risk that takes precedent.  The best interests of the children are that they don't give COVID-19 to their grandparent or great-grandparent.,False,1,0,,['https://twitter.com/i/web/status/1247918613584994304'],['jruemper'],Kamloops,British Columbia,-120.3192,50.66648
1247918540860076032,Wed Apr 08 16:05:40 +0000 2020,CCPAMB,Twitter for iPhone,"['whether', 'provide', 'emergency', 'care', 'sideline', 'pandemic', 'childcare', 'educator', 'need', 'protection', 'good', 'remuneration', 'respect', 'must', 'stop', 'rely', 'assume', 'great', 'responsibility', 'without', 'sufficient', 'preparation', 'support', 'reward']","Whether  providing emergency care or sidelined by the pandemic, childcare educators need protection, better remuneration, &amp; more respect. We must stop relying on them to assume great responsibility without sufficient preparation, support, or reward. https://t.co/tYe83MEu7M",True,0,0,,,['susanprentice'],Winnipeg,Manitoba,-97.14704,49.8844
1247918441408815106,Wed Apr 08 16:05:16 +0000 2020,ksinky,Twitter for Android,"['alberta', 'longer', 'follow', 'flawed', 'casual', 'meander', 'federal', 'policy', 'theresa', 'coronavirus', 'jkenney', 'chart', 'strategy', 'base', 'work', 'asia', 'slow', 'spread', 'kid', 'school', 'people', 'back', 'work', 'ableg', 'cdnpoli']","Alberta will no longer follow the flawed, casual &amp; meandering federal policies of Dr. Theresa Tam on coronavirus.

@jkenney charts new strategy based on what worked in Asia to slow the spread, get kids in school &amp; people back to work.

#ableg #cdnpoli 

https://t.co/hViAQ7eh7t https://t.co/iIuIRuNzr5",True,0,0,,,['DavidStaplesYEG'],,Alberta,-117.469,52.28333
1247918184004554752,Wed Apr 08 16:04:14 +0000 2020,Indus_Helps,Twitter Web App,"['support', 'family', 'learn', 'funding', 'family', 'apply', 'child', 'school', 'child', 'care', 'coronavirus', 'covid-19', 'find', 'eligible', 'apply', 'community', 'people', 'child', 'school']","Get support for families! Learn about funding that #families can apply for if they have children who are not in school or child care because of #coronavirus (COVID-19). Find out if you are eligible and how to apply.  https://t.co/mlm0V1E81B
 #community #people #children #schools",True,0,0,['families'],,['Indus_Helps'],Mississauga,Ontario,-79.6583,43.5789
1247917820425494529,Wed Apr 08 16:02:48 +0000 2020,LDN_OectaPac,Twitter Web App,"['whether', 'provide', 'emergency', 'care', 'sideline', 'pandemic', 'childcare', 'educator', 'need', 'protection', 'good', 'remuneration', 'respect', 'must', 'stop', 'rely', 'assume', 'great', 'responsibility', 'without', 'sufficient', 'preparation', 'support', 'reward']","Whether  providing emergency care or sidelined by the pandemic, childcare educators need protection, better remuneration, &amp; more respect. We must stop relying on them to assume great responsibility without sufficient preparation, support, or reward. https://t.co/tYe83MEu7M",True,0,0,,,['susanprentice'],London,Ontario,-81.23304,42.98339
1247917600715223041,Wed Apr 08 16:01:55 +0000 2020,dmirams,Hootsuite Inc.,"['great', 'global', 'child', 'care', 'crisis', 'parent', 'elementary', 'school', 'daycares', 'suddenly', 'close', 'worker', 'place', 'option', 'start', 'emerge']","The Great Global Child Care Crisis -- {What's a parent to do when all of elementary schools and daycares suddenly close? For some workers in some places, options are starting to emerge."" https://t.co/f9l3PrjKym https://t.co/2ZxSX7R1SE",False,0,0,,['https://twitter.com/i/web/status/1247917600715223041'],,Ajax,Ontario,-79.03288,43.85012
1247917120182083589,Wed Apr 08 16:00:01 +0000 2020,msfhr,Twitter Web App,"['safe', 'visit', 'friends/family', 'symptom-free', 'msfhr', '2008', 'trainee', 'catharinetc', 'discuss', 'take', 'risk', 'reduction', 'approach', 'socialdistancing', 'work', 'covid19', 'pandemic']","Is it safe to visit friends/family if you're symptom-free? MSFHR 2008 Trainee Dr @CatharineTC discusses why taking a ""risk reduction approach"" to #SocialDistancing doesn't work during the #COVID19 pandemic https://t.co/Rw5E6ROK4W https://t.co/iOiTghCH1s",False,2,1,,['https://twitter.com/i/web/status/1247917120182083589'],['CatharineTC'],Vancouver,British Columbia,-123.11934,49.24966
1247916921204305921,Wed Apr 08 15:59:13 +0000 2020,CCCA_BC,Twitter for iPhone,"['covid', 'childcare', 'centre', 'australia', 'seven', 'staff', 'member', 'child', 'test', 'positive']",COVID in childcare centre in Australia - seven staff members and six children now test positive. https://t.co/FkO25VIrWa,True,0,0,,['https://7news.com.au/lifestyle/health-wellbeing/coronavirus-sydney-more-than-a-dozen-people-from-blacktown-childcare-centre-test-positive-to-covid-19-c-957033?utm_campaign=share-icons&utm_source=twitter&utm_medium=social&tid=1586119504893'],['susanprentice'],,British Columbia,-125.0032,53.99983
1247916844020711425,Wed Apr 08 15:58:55 +0000 2020,YaneValdezT,Twitter for iPhone,"['thomasbeyer', 'heartofahuman1', 'jjhorgan', 'mother', 'doctorate', 'immunology', 'infectious', 'disease', 'would', 'school', 'face', 'virus', 'begin', 'understand']",@ThomasBeyer @Heartofahuman1 @jjhorgan As a mother with a doctorate in immunology and infectious diseases. I would not let my kid to go to school and face a virus we are beginning to understand.,False,1,0,,['https://twitter.com/i/web/status/1247916844020711425'],"['ThomasBeyer', 'Heartofahuman1', 'jjhorgan']",Vancouver,British Columbia,-123.11934,49.24966
1247916316587163655,Wed Apr 08 15:56:49 +0000 2020,AlykhanAbdulla,Twitter Web App,"['reduce', 'risk', 'infection', 'mother/', 'child', 'ontariomidwives', 'also', 'cognizant', 'risk', 'home', 'delivery', 'reach', 'on_familyhealth', 'ontarioobgyns', 'weigh', 'risk', 'home', 'hospital', 'delivery']","I am all for reducing the risk of infections for both mother/ child + a fan of @ontariomidwives I am also cognizant of the some of the risks of home deliveries so reach out to @ON_FamilyHealth @OntarioObgyns to weigh risks of home vs. hospital deliveries

https://t.co/mQXX8shmqH",False,1,0,,['https://twitter.com/i/web/status/1247916316587163655'],['ontariomidwives'],,,-113.64258,60.10867
1247916061221171200,Wed Apr 08 15:55:48 +0000 2020,jetkerr,Twitter for iPhone,"['socialdistancing', 'physicaldistancing', 'help', 'keep', 'community', 'safe', 'coronavirus', 'covid_19', 'covid19', '5-minute', 'digitalhealth', 'application', 'build', 'avatar', 'share', 'friend', 'family', 'covid19canada']","How does #SocialDistancing #PhysicalDistancing help keep your community safe from the #Coronavirus #Covid_19 #Covid19? A 5-minute #DigitalHealth application. Build your own avatars and see, and share with your friends &amp; family! #Covid19Canada https://t.co/yECcjZToIG",True,0,0,"['SocialDistancing', 'PhysicalDistancing', 'Coronavirus', 'Covid_19', 'Covid19']",,['wittemanlab'],Ottawa,Ontario,-75.69812,45.41117
1247915681439309824,Wed Apr 08 15:54:18 +0000 2020,medical91,Twitter Web App,"['socialdistancing', 'physicaldistancing', 'help', 'keep', 'community', 'safe', 'coronavirus', 'covid_19', 'covid19', '5-minute', 'digitalhealth', 'application', 'build', 'avatar', 'share', 'friend', 'family', 'covid19canada']","How does #SocialDistancing #PhysicalDistancing help keep your community safe from the #Coronavirus #Covid_19 #Covid19? A 5-minute #DigitalHealth application. Build your own avatars and see, and share with your friends &amp; family! #Covid19Canada https://t.co/yECcjZToIG",True,0,0,"['SocialDistancing', 'PhysicalDistancing', 'Coronavirus', 'Covid_19', 'Covid19']",,['wittemanlab'],,,-113.64258,60.10867
1247915616717111298,Wed Apr 08 15:54:02 +0000 2020,LukesPlace1,Twitter Web App,"['deal', 'abusive', 'partner/ex-partner', 'family', 'issue', 'like', 'safety', 'child', 'custody', 'finance', 'help', 'phone/video-conference', 'legal', 'support', 'service', 'detail']","Dealing with an abusive partner/ex-partner over family law issues like safety, child custody, finances? We can help with phone/video-conference legal &amp; support services. Get details here:
https://t.co/tTJyxjJ3lH https://t.co/ZNIGuYCbbo",False,5,11,,['https://twitter.com/i/web/status/1247915616717111298'],,Oshawa,Ontario,-78.84957,43.90012
1247915034564603904,Wed Apr 08 15:51:44 +0000 2020,picardonhealth,Twitter Web App,"['socialdistancing', 'physicaldistancing', 'help', 'keep', 'community', 'safe', 'coronavirus', 'covid_19', 'covid19', '5-minute', 'digitalhealth', 'application', 'build', 'avatar', 'share', 'friend', 'family', 'covid19canada']","How does #SocialDistancing #PhysicalDistancing help keep your community safe from the #Coronavirus #Covid_19 #Covid19? A 5-minute #DigitalHealth application. Build your own avatars and see, and share with your friends &amp; family! #Covid19Canada https://t.co/yECcjZToIG",True,0,0,"['SocialDistancing', 'PhysicalDistancing', 'Coronavirus', 'Covid_19', 'Covid19']",,['wittemanlab'],Montreal,Quebec,-73.58781,45.50884
1247914036609548289,Wed Apr 08 15:47:46 +0000 2020,CBar_Barros,Twitter for iPad,"['comment', 'covid-19', 'school', 'closure', 'child', 'poverty', 'social', 'crisis', 'making']","New Comment #COVID-19, school closures, and child poverty: a social crisis in the making  https://t.co/jW7aFwBGGO https://t.co/80Sug1ixJe",True,0,0,['COVID'],['https://www.thelancet.com/journals/lanpub/article/PIIS2468-2667(20)30084-0/fulltext'],['TheLancetPH'],,,-113.64258,60.10867
1247913810016505858,Wed Apr 08 15:46:52 +0000 2020,linda4workers,Twitter for iPhone,"['member', 'life', 'family', 'want', 'job', 'professionally', 'unselfishly', 'become', 'increasingly', 'untenable', 'nobody', 'look', 'child']","""Our members have lives and families. They want to do their jobs professionally and unselfishly, but that is becoming increasingly untenable when there is nobody to look after their children.""

https://t.co/8fBdITse9Z",True,0,0,,,['INMO_IRL'],Ottawa,Ontario,-75.69812,45.41117
1247913292342775810,Wed Apr 08 15:44:48 +0000 2020,coastal_nurse,Twitter Web App,"['know', 'yong', 'close', 'year', 'work', 'aid', 'write', 'recommendation', 'grad', 'school', 'wrong', 'family', 'separation', 'support', 'science', 'cruel', 'over-reaction', 'violation', 'human', 'right']","I've known Jim Yong Kim for close to 20 years. I worked with him on AIDS, he wrote my recommendations for grad school. He's WRONG on family separations. It's not supported by the science and is a cruel over-reaction and a violation of human rights. 1/ https://t.co/Fm6ISyS0Zi",True,0,0,,,['gregggonsalves'],Vancouver,British Columbia,-123.11934,49.24966
1247913201846685698,Wed Apr 08 15:44:27 +0000 2020,pys_online,Twitter Web App,"['know', 'support', 'available', 'family', 'child', 'school', 'child', 'care', 'covid-19', 'visit', 'link', 'additional', 'detail', 'youthrthefuture', 'wearehere', 'youth', 'mentalhealth', 'onlyacallaway']","Did you know that there are supports available for families with children who are not in school or child care because of COVID-19?  Visit this link for additional details!
https://t.co/kJvZZctGxO
#youthRthefuture #wearehere #youth #mentalhealth #onlyacallaway",False,0,0,,['https://twitter.com/i/web/status/1247913201846685698'],,Peterborough,Ontario,-78.31623,44.30012
1247912555319721985,Wed Apr 08 15:41:52 +0000 2020,IRMiiilllky,Twitter for Android,"['fact', 'covid-19', 'social', 'distancing', 'help', 'slow', 'spread', 'wash', 'hand', 'effective', 'stay', 'healthy', 'even', 'young', 'still', 'pose', 'threat', 'immediate', 'family', 'friend', 'risk', 'jeffrey', 'epstein', 'kill']","Here are some FACTS about COVID-19:
- Social distancing will help slow the spread.
- Washing your hands is an effective way to stay healthy
- Even if you're young it can still pose a threat to immediate family or friends who are at risk
- Jeffrey Epstein didn't kill himself.",False,2,0,,['https://twitter.com/i/web/status/1247912555319721985'],,,,-113.64258,60.10867
1247911354293460993,Wed Apr 08 15:37:06 +0000 2020,BGCCAN,Twitter for Android,"['thank', 'loblawco', 'enough', 'incredible', 'donation', 'help', 'boy', 'girl', 'club', 'food', 'need', 'help', 'generous', 'display', 'amaze', 'community', 'leader', 'bgccan', 'strongertogether', 'read']","We can't thank @loblawco enough for their incredible donation to help Boys and Girls Clubs get food to those who need our help most. A generous display by amazing community leaders 💚
@BGCCAN #StrongerTogether
Read More: 🔗https://t.co/11ccPEiMVM https://t.co/27WlXRbZ6l",True,0,0,,,"['bgcokanagan', 'loblawco']",,,-113.64258,60.10867
1247911310916009986,Wed Apr 08 15:36:56 +0000 2020,IanArthurMPP,Twitter Web App,"['change', 'family', 'presence', 'policy', 'difficult', 'important', 'help', 'keep', 'patient', 'staff', 'safe', 'learn', 'stay', 'connect']","While changes to our Family Presence policy has been difficult for some, it is important to help keep our patients and staff safe. Learn more about how you can stay connected here: https://t.co/VW33aYo6SI https://t.co/it3OJTpItC",True,0,0,,,['KingstonHSC'],Kingston,Ontario,-76.48098,44.22976
1247911108033122304,Wed Apr 08 15:36:07 +0000 2020,jashead,Twitter Web App,"['know', 'yong', 'close', 'year', 'work', 'aid', 'write', 'recommendation', 'grad', 'school', 'wrong', 'family', 'separation', 'support', 'science', 'cruel', 'over-reaction', 'violation', 'human', 'right']","I've known Jim Yong Kim for close to 20 years. I worked with him on AIDS, he wrote my recommendations for grad school. He's WRONG on family separations. It's not supported by the science and is a cruel over-reaction and a violation of human rights. 1/ https://t.co/Fm6ISyS0Zi",True,0,0,,,['gregggonsalves'],Vancouver,British Columbia,-123.11934,49.24966
1247910337262817283,Wed Apr 08 15:33:04 +0000 2020,mattvendramini,Twitter Web App,"['charliekirk11', 'jesus', 'save', 'enemy', 'charlie', 'science', 'isolation', 'stop', 'virus', 'remain', 'family', 'sick', 'risk']","@charliekirk11 Jesus won't save you from this enemy, Charlie... science will. Isolation is how you stop a virus.. By remaining with your family if you are sick, you put them at risk.",False,0,0,,['https://twitter.com/i/web/status/1247910337262817283'],['charliekirk11'],Toronto,Ontario,-79.4163,43.70011
1247909787263795200,Wed Apr 08 15:30:52 +0000 2020,Durcanrebecca,Twitter Web App,"['homeschooling', 'sahm', 'wfher', 'whose', 'kid', 'attend', 'school', 'trust', 'successfully', 'mash', 'role', 'keep', 'pandemic', 'parent', 'trouble', 'distraction', 'know']","I have been a homeschooling SAHM. 

I have been a WFH’er whose kids attend school.

Trust me when I say you cannot successfully mash those 2 roles, while keeping one eye on a pandemic, and the other eye on a parent in LTC (or other troubling distraction - I know most have more).",True,0,0,,,['AmandaDimilta'],Toronto,Ontario,-79.4163,43.70011
1247908503685128196,Wed Apr 08 15:25:46 +0000 2020,YUResearch,Twitter Web App,"['replicate', 'school', 'home', 'expect', 'parent', 'teacher', 'say', 'yorkueducation', 'assistant', 'prof', 'vidya', 'shah', 'vidyashah6', 'hellocanada', 'covid19']","We can’t replicate school at home so we shouldn’t expect parents to be teachers, says @YorkUeducation Assistant Prof Vidya Shah @VidyaShah6 https://t.co/CiA2yfHlxn via @HelloCanada #COVID19",True,0,0,,,"['YorkUnews', 'YorkUeducation']",Toronto,Ontario,-79.4163,43.70011
1247908467567996931,Wed Apr 08 15:25:38 +0000 2020,T_Macdonald2,Twitter for Android,"['change', 'family', 'presence', 'policy', 'difficult', 'important', 'help', 'keep', 'patient', 'staff', 'safe', 'learn', 'stay', 'connect']","While changes to our Family Presence policy has been difficult for some, it is important to help keep our patients and staff safe. Learn more about how you can stay connected here: https://t.co/VW33aYo6SI https://t.co/it3OJTpItC",True,0,0,,,['KingstonHSC'],Hamilton,Ontario,-79.84963,43.25011
1247908203502792705,Wed Apr 08 15:24:35 +0000 2020,HoganBCMJ,Twitter Web App,"['ruling', 'transcribe', 'judge', 'interest', 'deny', 'father', 'access', 'child', 'covid-19', 'live', 'at-risk', 'individual', 'father', 'must', 'travel', 'kid', 'rare', 'public', 'health', 'risk', 'impact']",This ruling I'm transcribing by a BC judge is interesting.  She is denying a father access to his children due to COVID-19 because they live with at-risk individuals &amp; the father must travel by air to see his kids. It's rare that a public health risk impacts the law in this way.,False,12,0,,['https://twitter.com/i/web/status/1247908203502792705'],,Kamloops,British Columbia,-120.3192,50.66648
1247907721413787648,Wed Apr 08 15:22:40 +0000 2020,HargreavesBC,Twitter Web App,"['anymore', 'sustainable', 'teacher-parent', 'say', 'less', 'covid19', 'valeriestrauss', 'calphonso', 'msoskil', 'ascd', 'washingtonpost', 'aftunion']","""I can’t &amp;$#@ing do this anymore. This is not sustainable"". A teacher-parent says that less is more during #COVID19 https://t.co/QdpL36NVgg @valeriestrauss @calphonso @msoskil @ASCD @washingtonpost @AFTunion",False,16,9,['COVID19'],['https://twitter.com/i/web/status/1247907721413787648'],,Ottawa,Ontario,-75.69812,45.41117
1247906763371958272,Wed Apr 08 15:18:52 +0000 2020,jesuisjanaina,Twitter for iPhone,"['federal', 'government', 'sanction', 'wednesday', 'determine', 'food', 'purchase', 'school', 'lunch', 'must', 'distribute', 'parent', 'child', 'adolescent', 'unable', 'receive', 'meal', 'covid-19-related', 'lockdown', 'measure']",The federal government sanctioned a law on Wednesday to determine that food purchased as school lunches must be distributed to the parents of children and adolescents who are unable to receive these meals due to Covid-19-related lockdown measures https://t.co/LEcnPaTvaP,True,0,0,,,['BrazilianReport'],Winnipeg,Manitoba,-97.14704,49.8844
1247906605493977088,Wed Apr 08 15:18:14 +0000 2020,TeamAmitAiri,Twitter Web App,"['hope', 'family', 'stay', 'safe', 'covid', 'pandemic', 'stay', 'touch', 'communicate', 'family', 'friend', 'importanti', 'live', 'everyday', 'monday', 'saturday']","I hope you and your family are staying safe in this Covid 19 pandemic.
Staying in touch and communicating with family &amp; friends is very important.I will be Live everyday from 5 Pm to 6PM (Monday to Saturday) 

https://t.co/NvKlhu3ISQ https://t.co/jHrPlgZvgw",False,0,0,,['https://twitter.com/i/web/status/1247906605493977088'],,Cambridge,Ontario,-80.31269,43.3601
1247906319895420929,Wed Apr 08 15:17:06 +0000 2020,PlayfulPathFelt,Twitter for Android,"['reminder', 'is/was', 'important', 'child', 'care', 'program', 'guideline', 'practice', 'specific', 'covod-19', 'place', 'provincial', 'government', 'well', 'others', 'fredericton', 'daycare', 'confirm', 'case', 'covid-19', 'news']","A reminder why it is/was so important for child care programs to have guidelines and practices, specific to COVOD-19 in place. Some provincial governments did well on this, others...........Fredericton daycare has confirmed case of COVID-19 | CBC News https://t.co/96vJ13iPO5",True,0,0,,,['CCCF_FCSGE'],Surrey,British Columbia,-122.82509,49.10635
1247905963073392640,Wed Apr 08 15:15:41 +0000 2020,KingstonHSC,TweetDeck,"['change', 'family', 'presence', 'policy', 'difficult', 'important', 'help', 'keep', 'patient', 'staff', 'safe', 'learn', 'stay', 'connect']","While changes to our Family Presence policy has been difficult for some, it is important to help keep our patients and staff safe. Learn more about how you can stay connected here: https://t.co/VW33aYo6SI https://t.co/it3OJTpItC",False,21,8,,['https://twitter.com/i/web/status/1247905963073392640'],,Kingston,Ontario,-76.48098,44.22976
1247905863051776002,Wed Apr 08 15:15:17 +0000 2020,bgcokanagan,Twitter Web App,"['thank', 'loblawco', 'enough', 'incredible', 'donation', 'help', 'boy', 'girl', 'club', 'food', 'need', 'help', 'generous', 'display', 'amaze', 'community', 'leader', 'bgccan', 'strongertogether', 'read']","We can't thank @loblawco enough for their incredible donation to help Boys and Girls Clubs get food to those who need our help most. A generous display by amazing community leaders 💚
@BGCCAN #StrongerTogether
Read More: 🔗https://t.co/11ccPEiMVM https://t.co/27WlXRbZ6l",False,9,1,,['https://twitter.com/i/web/status/1247905863051776002'],['loblawco'],West Kelowna,British Columbia,-119.58333,49.8625
1247905547745030144,Wed Apr 08 15:14:02 +0000 2020,shawtyn3xtdoor,Twitter for iPhone,"['somali', 'mother', 'maryan', 'ahmed', 'kill', 'husband', 'london', 'week', 'domestic', 'violence', 'increase', 'quarantine', 'virus', 'check', 'family', 'member', 'heartbreaking', 'allah', 'bless', 'jannah', 'stay', 'safe']","This Somali mother, Maryan Ahmed, was killed by her husband in London this week. Domestic violence is increasing during quarantine / virus...we gotta check on our family members. Just heartbreaking. May Allah bless her in Jannah.💔

Stay safe! https://t.co/kuylTpufCA",True,0,0,,,['hafsamohamed1'],Melbourne,Victoria,144.96332,-37.814
1247905215434510337,Wed Apr 08 15:12:42 +0000 2020,Kentertainer,Twitter Web Client,"['tell', 'child', 'world', 'seem', 'unsafe', 'york', 'time']",What We Tell Children When the World Seems Unsafe - The New York Times https://t.co/MZASJNvUgF,False,0,0,,['https://www.nytimes.com/2020/04/07/well/family/virus-children-songs-WWII-safety.html'],,Vancouver,British Columbia,-123.11934,49.24966
