id,created_at,screen_name,source,clean_text,original_text,is_retweet,favorite_count,retweet_count,hashtags,urls,mentions,city,province,longitude,latitude
1252377758442721286,2020-04-20 23:25:00+00:00,Quayfox,Twitter Web App,"['michelle', 'rempel', 'claim', 'second', 'husband', 'child', 'self-admittedly', 'break', 'protocol', 'oklahoma', 'governor', 'lock', 'citizen', 'safety', 'attack', 'elizabeth', 'try', 'keep', 'people', 'safe', 'obey', 'lockdown', 'bourgeois', 'socialist']",Michelle Rempel claims her second husband’s children as her own and self-admittedly breaks protocols to ask the Oklahoma governor to lock down citizens for safety as she attacks Elizabeth May for trying to keep people safe by obeying the lockdown. Who is the bourgeois socialist? https://t.co/MwoEx36F2Q,True,0.0,0.0,,,['PoliticalCupid'],Langford,British Columbia,-123.50261,48.44963
1252378380881690627,2020-04-20 23:27:28+00:00,MRoyer3,Twitter Web App,"['skylar', 'herbert', 'name', 'remember', 'face', 'covid-19', 'real', 'loss', 'family', 'experience', 'real', 'stay-at-home', 'order', 'safety', 'safety', 'rest', 'easy', 'princess']","SKYLAR HERBERT.
say her name and remember her face. COVID-19 is real. the loss my family is experiencing is real. these stay-at-home orders are for our safety...they were for her safety.

rest easy princess. 🤍 https://t.co/qac60kPT9I",True,0.0,0.0,,,['makhalameshaun'],Edmonton,Alberta,-113.46871000000002,53.55014
1252379159084457985,2020-04-20 23:30:34+00:00,JillStarkesMD,Twitter for iPhone,"['cpsp', 'study', 'provide', 'essential', 'time-sensitive', 'information', 'child', 'great', 'risk', 'serious', 'complication', 'covid19', 'benefit', 'novel', 'therapy', 'possible', 'prevention', 'effort', 'detail', 'childhealth']","A new CPSP study will provide essential, time-sensitive information about which children are at greatest risk of serious complications from #COVID19, and who may benefit most from novel therapies and possible prevention efforts. Details: https://t.co/DSrVtQwCWX #ChildHealth https://t.co/LvJ9RutIYm",True,0.0,0.0,,,['CanPaedSociety'],Charlottetown,Prince Edward Island,-63.126709999999996,46.23525
1252379276923375617,2020-04-20 23:31:02+00:00,RyderPmr,Twitter for Android,"['listen', 'folk', 'lie', 'citizenship', 'work', 'history', 'stole', 'money', 'party', 'health', 'wife', 'child', 'risk', 'pandemic', 'talk', 'canadian', 'responsible', 'behaviour']","Listen up folks - a man who lied about his citizenship and work history, stole money from his party, and put the health of his wife and children at risk during a pandemic is here to talk to Canadians about responsible behaviour. https://t.co/khRtr0sfhr",True,0.0,0.0,,,['the_ns'],Hamilton,Ontario,-79.84963,43.25011
1252379481433489409,2020-04-20 23:31:51+00:00,ItisMoody,Twitter for Android,"['safe', 'safe', 'pandemic', 'borderless', 'proud', 'response', 'covid_19', 'borderless', 'well', 'staff', 'around', 'hard', 'work', 'ensure', 'vulnerable', 'child', 'especially', 'girl', 'support', 'time']","We're not safe until ALL of us are safe. This pandemic is borderless and we're proud that 🇨🇦's response to #COVID_19 is borderless as well. 

Our staff around the 🌍 is hard at work ensuring that the most vulnerable children, especially girls, are supported at this time. https://t.co/0csCAEkLRu",True,0.0,0.0,['COVID_19'],,['PlanCanada'],Toronto,Ontario,-79.4163,43.700109999999995
1252379908791169029,2020-04-20 23:33:33+00:00,haseebvirk,Twitter for Android,"['pakistani', 'muslim', 'refuse', 'utensil', 'drink', 'glass', 'non-muslims', 'fear', 'contaminate', 'forcefully', 'mosque', 'contract', 'virus', 'share', 'family', 'return', 'home', 'logic', 'undeniable']","Pakistani Muslims will refuse to use the same utensils or drink from the same glass as non-Muslims for fear of being contaminated, but will forcefully go to the mosque to contract a virus they will share with their family when they return home.

The logic is undeniable.",True,0.0,0.0,,,['marketingdude'],,,-113.64258000000001,60.10867
1252380181001428993,2020-04-20 23:34:37+00:00,SolidFooting,Twitter for iPhone,"['brilliant', 'webinar', 'cfhi_fcass', 'afternoon', 'partner', 'family', 'caregiver', 'covid-19', 'lot', 'question', 'patient', 'safety', 'implication', 'limited', 'visitor', 'policy', 'measure', 'know', 'anyone', 'work', 'maggiekeresteci', 'solidfooting']",Brilliant webinar from @CFHI_FCASS this afternoon on partnering with family caregivers in COVID-19. Lots of questions  patient safety implications of limited visitor policies &amp; if they are being measured...Do we know if anyone is  doing this work? @MaggieKeresteci @SolidFooting,True,0.0,0.0,,,"['courtneyjshaw1', 'CFHI_FCASS']",Ottawa,Ontario,-75.69811999999999,45.41117
1252380526242979840,2020-04-20 23:36:00+00:00,Faster_Bunny,Twitter Web App,"['risk', 'low', 'child', 'risk', 'covid19', 'health', 'official', 'examine', '149760', 'case', 'know', 'find', '2572', 'case', 'young', 'three', 'child', 'die', 'stayhomesavelives', 'onevoice1']","The risk is lower for children but they are at risk of #COVID19

U.S health officials examined 149,760 cases where age was known and found that 2,572 of the cases, or 1.7%, were younger than 18. 

Three children have died.

#StayHomeSaveLives 
#OneVoice1

https://t.co/PRROTeFH8f https://t.co/RvglxFWy37",True,0.0,0.0,['COVID19'],,['CobaltDaisy'],Toronto,Ontario,-79.4163,43.700109999999995
1252380969484513281,2020-04-20 23:37:45+00:00,MissKGlam,Twitter for iPhone,"['commonto99', 'haltonpolice', 'living', 'police', 'keep', 'safe', 'try', 'stop', 'ongoing', 'spread', 'pandemic', 'attitude', 'like', 'problem', 'people', 'frontline', 'risk', 'life', 'family', 'save', 'life']","@CommonTO99 @HaltonPolice This is not about living In a police https://t.co/qMhSctGbvt’s about keeping safe &amp; trying 2 stop the ongoing spread of this pandemic. Attitudes like yours are the problem. There’s people on the frontline who are risking their life, their family to save lives.",False,2.0,0.0,,"['http://state.It', 'https://twitter.com/i/web/status/1252380969484513281']",['HaltonPolice'],Hamilton,Ontario,-79.84963,43.25011
1252382142853570561,2020-04-20 23:42:25+00:00,Learning2GetBy,Twitter for Android,"['michelle', 'rempel', 'claim', 'second', 'husband', 'child', 'self-admittedly', 'break', 'protocol', 'oklahoma', 'governor', 'lock', 'citizen', 'safety', 'attack', 'elizabeth', 'try', 'keep', 'people', 'safe', 'obey', 'lockdown', 'bourgeois', 'socialist']",Michelle Rempel claims her second husband’s children as her own and self-admittedly breaks protocols to ask the Oklahoma governor to lock down citizens for safety as she attacks Elizabeth May for trying to keep people safe by obeying the lockdown. Who is the bourgeois socialist? https://t.co/MwoEx36F2Q,True,0.0,0.0,,,['PoliticalCupid'],Winnipeg,Manitoba,-97.14704,49.8844
1252383354923520000,2020-04-20 23:47:14+00:00,franceschinian2,Twitter for Android,"['research', 'paper', 'italian', 'town', 'lock', 'early', 'test', 'almost', 'resident', 'note', 'child', 'even', 'test', 'positive', 'virus', 'teenager', 'remind', 'close', 'school']","1/ A research paper from Vo (an Italian town that locked down early and tested almost all residents) is out. Of note: NOT ONE CHILD UNDER 10 (OUT OF 234) EVEN TESTED POSITIVE FOR THE VIRUS. (One teenager did.) Remind me why we've closed schools?

https://t.co/9HbnXumxR2",True,0.0,0.0,,,['AlexBerenson'],Hamilton,Ontario,-79.84963,43.25011
1252386017241255938,2020-04-20 23:57:49+00:00,SHDChristineB,Twitter for iPhone,"['michelle', 'rempel', 'claim', 'second', 'husband', 'child', 'self-admittedly', 'break', 'protocol', 'oklahoma', 'governor', 'lock', 'citizen', 'safety', 'attack', 'elizabeth', 'try', 'keep', 'people', 'safe', 'obey', 'lockdown', 'bourgeois', 'socialist']",Michelle Rempel claims her second husband’s children as her own and self-admittedly breaks protocols to ask the Oklahoma governor to lock down citizens for safety as she attacks Elizabeth May for trying to keep people safe by obeying the lockdown. Who is the bourgeois socialist? https://t.co/MwoEx36F2Q,True,0.0,0.0,,,['PoliticalCupid'],,,-113.64258000000001,60.10867
1262902354074054662,2020-05-20 00:25:59+00:00,zarjacks,Twitter for iPhone,"['break', 'school', 'france', 'say', 'make', 'terrible', 'mistake', 'reopen', 'school', 'system', 'french', 'school', 'shut', 'back', 'today', 'covid-19', 'infection', 'child', 'reach', 'epidemic', 'proportion', 'happen', 'devos/trump', 'plan', 'open', 'back', 'america']","BREAKING - Schools in FRANCE said they made a TERRIBLE MISTAKE reopening their school system. FRENCH SCHOOLS SHUT BACK DOWN TODAY after COVID-19 infections in the children reach Epidemic proportions!

Is this what’ll happen UNDER THE DEVOS/TRUMP plan to OPEN BACK UP AMERICA?",True,0.0,0.0,,,['FrankSowa1'],Hamilton,Ontario,-79.84963,43.25011
1262902581967425538,2020-05-20 00:26:53+00:00,Kippy_mag_oddi,Twitter for Android,"['break', 'school', 'france', 'say', 'make', 'terrible', 'mistake', 'reopen', 'school', 'system', 'french', 'school', 'shut', 'back', 'today', 'covid-19', 'infection', 'child', 'reach', 'epidemic', 'proportion', 'happen', 'devos/trump', 'plan', 'open', 'back', 'america']","BREAKING - Schools in FRANCE said they made a TERRIBLE MISTAKE reopening their school system. FRENCH SCHOOLS SHUT BACK DOWN TODAY after COVID-19 infections in the children reach Epidemic proportions!

Is this what’ll happen UNDER THE DEVOS/TRUMP plan to OPEN BACK UP AMERICA?",True,0.0,0.0,,,['FrankSowa1'],Hamilton,Ontario,-79.84963,43.25011
1262902831822094338,2020-05-20 00:27:53+00:00,ruth34855040,Twitter for Android,"['break', 'school', 'france', 'say', 'make', 'terrible', 'mistake', 'reopen', 'school', 'system', 'french', 'school', 'shut', 'back', 'today', 'covid-19', 'infection', 'child', 'reach', 'epidemic', 'proportion', 'happen', 'devos/trump', 'plan', 'open', 'back', 'america']","BREAKING - Schools in FRANCE said they made a TERRIBLE MISTAKE reopening their school system. FRENCH SCHOOLS SHUT BACK DOWN TODAY after COVID-19 infections in the children reach Epidemic proportions!

Is this what’ll happen UNDER THE DEVOS/TRUMP plan to OPEN BACK UP AMERICA?",True,0.0,0.0,,,['FrankSowa1'],Espanola,Ontario,-81.76649,46.25837
1262902965565714432,2020-05-20 00:28:25+00:00,drkcraven,Twitter for Android,"['world', 'family', 'doctor', 'arrive', 'human', 'tank', 'run', 'fume', 'receive', 'card', 'thanks', 'student', 'invite', 'video', 'link', 'class', 'talk', 'covid-19', 'kid', 'know', 'share', 'enthusiasm', 'wfdd20', 'abdocs4patients']",World Family Doctors Day arrives just when my human’s gas tank is running on fumes. She received a card of thanks from students who had invited her to video link to their class to talk about COVID-19. Kids just know how to share joy &amp; enthusiasm!!! 🥰 #WFDD20 #abdocs4patients,True,0.0,0.0,,,['ScruffyCraven'],,Alberta,-117.469,52.28333
1262903096583299080,2020-05-20 00:28:56+00:00,Juliepesonen,Twitter for iPhone,"['brettgraysondad', 'hear', 'never', 'felt', 'painful', 'begin', 'social', 'child', 'lock', 'small', 'home', '9hrs', 'alone', 'week', 'hurt', 'mentally', 'govt', 'say', 'school', 'open', 'sept', 'lockdown', 'continue', 'hurt', 'heart']","@brettgraysondad I hear ya.  I never felt that it was ok- it’s been painful from the begin’g.  A social 6yr, only child, locked in a small home for 9hrs let alone 9+ weeks has hurt him mentally and me me.  Day 63 our govt said no schools open until sept. Lockdown continues and it hurts my heart.",False,0.0,0.0,,['https://twitter.com/i/web/status/1262903096583299080'],['brettgraysondad'],Richmond Hill,Ontario,-79.43725,43.871109999999994
1262904297668243456,2020-05-20 00:33:42+00:00,downtownjuliab,Twitter for iPhone,"['wflbc', 'jjhorgan', 'think', 'benefit', 'daughter', 'back', 'get', 'taste', 'school', 'like', 'covid', 'time', 'might', 'less', 'overwhelming', 'use', 'september', 'along', 'grade/teacher/class']","@WFLBC @jjhorgan I have been thinking about this a lot. The only benefit I can see for my daughter to go back is her getting a taste of what school is like in covid times. Might be less overwhelming than to have to get used to it in September, along with a new grade/teacher/class etc",False,1.0,0.0,,['https://twitter.com/i/web/status/1262904297668243456'],"['WFLBC', 'jjhorgan']",Vancouver,British Columbia,-123.11934,49.24966
1262904300784824321,2020-05-20 00:33:43+00:00,osmond71,Twitter for Android,"['break', 'school', 'france', 'say', 'make', 'terrible', 'mistake', 'reopen', 'school', 'system', 'french', 'school', 'shut', 'back', 'today', 'covid-19', 'infection', 'child', 'reach', 'epidemic', 'proportion', 'happen', 'devos/trump', 'plan', 'open', 'back', 'america']","BREAKING - Schools in FRANCE said they made a TERRIBLE MISTAKE reopening their school system. FRENCH SCHOOLS SHUT BACK DOWN TODAY after COVID-19 infections in the children reach Epidemic proportions!

Is this what’ll happen UNDER THE DEVOS/TRUMP plan to OPEN BACK UP AMERICA?",True,0.0,0.0,,,['FrankSowa1'],Dartmouth,Nova Scotia,-63.57719,44.67134
1262905223804096513,2020-05-20 00:37:23+00:00,A_Romano2020,Twitter for iPhone,"['break', 'school', 'france', 'say', 'make', 'terrible', 'mistake', 'reopen', 'school', 'system', 'french', 'school', 'shut', 'back', 'today', 'covid-19', 'infection', 'child', 'reach', 'epidemic', 'proportion', 'happen', 'devos/trump', 'plan', 'open', 'back', 'america']","BREAKING - Schools in FRANCE said they made a TERRIBLE MISTAKE reopening their school system. FRENCH SCHOOLS SHUT BACK DOWN TODAY after COVID-19 infections in the children reach Epidemic proportions!

Is this what’ll happen UNDER THE DEVOS/TRUMP plan to OPEN BACK UP AMERICA?",True,0.0,0.0,,,['FrankSowa1'],,British Columbia,-125.0032,53.99983
1262905324945592321,2020-05-20 00:37:47+00:00,DebbieHowes6,Twitter for iPhone,"['break', 'school', 'france', 'say', 'make', 'terrible', 'mistake', 'reopen', 'school', 'system', 'french', 'school', 'shut', 'back', 'today', 'covid-19', 'infection', 'child', 'reach', 'epidemic', 'proportion', 'happen', 'devos/trump', 'plan', 'open', 'back', 'america']","BREAKING - Schools in FRANCE said they made a TERRIBLE MISTAKE reopening their school system. FRENCH SCHOOLS SHUT BACK DOWN TODAY after COVID-19 infections in the children reach Epidemic proportions!

Is this what’ll happen UNDER THE DEVOS/TRUMP plan to OPEN BACK UP AMERICA?",True,0.0,0.0,,,['FrankSowa1'],,British Columbia,-125.0032,53.99983
1262905383007313920,2020-05-20 00:38:01+00:00,madam0526,Twitter for iPhone,"['break', 'school', 'france', 'say', 'make', 'terrible', 'mistake', 'reopen', 'school', 'system', 'french', 'school', 'shut', 'back', 'today', 'covid-19', 'infection', 'child', 'reach', 'epidemic', 'proportion', 'happen', 'devos/trump', 'plan', 'open', 'back', 'america']","BREAKING - Schools in FRANCE said they made a TERRIBLE MISTAKE reopening their school system. FRENCH SCHOOLS SHUT BACK DOWN TODAY after COVID-19 infections in the children reach Epidemic proportions!

Is this what’ll happen UNDER THE DEVOS/TRUMP plan to OPEN BACK UP AMERICA?",True,0.0,0.0,,,['FrankSowa1'],,,-113.64258000000001,60.10867
1262905879910912000,2020-05-20 00:40:00+00:00,SalVadacchino1,Twitter Web App,"['break', 'school', 'france', 'say', 'make', 'terrible', 'mistake', 'reopen', 'school', 'system', 'french', 'school', 'shut', 'back', 'today', 'covid-19', 'infection', 'child', 'reach', 'epidemic', 'proportion', 'happen', 'devos/trump', 'plan', 'open', 'back', 'america']","BREAKING - Schools in FRANCE said they made a TERRIBLE MISTAKE reopening their school system. FRENCH SCHOOLS SHUT BACK DOWN TODAY after COVID-19 infections in the children reach Epidemic proportions!

Is this what’ll happen UNDER THE DEVOS/TRUMP plan to OPEN BACK UP AMERICA?",True,0.0,0.0,,,['FrankSowa1'],Quebec,Quebec,-71.21454,46.81228
1262905917948993537,2020-05-20 00:40:09+00:00,PrairiePostAlta,Twitter Web App,"['tomorrow', 'business', 'support', 'join', 'amanda', 'lynn', '07:30', 'hear', 'rise', 'star', 'learn', 'child', 'care', 'centre', 'keep', 'staff', 'child', 'safe', 're-launch', 'phase', 'covid', 'pandemic', 'medhat']",Tomorrow on YXH Business Support join Amanda Lynn at 07:30 to hear what the Rising Stars Learning &amp; Child Care Centre is doing to keep their staff and your children safe through the re-launch phase of the COVID Pandemic. #MedHat https://t.co/lsNaw6mzbr,True,0.0,0.0,,,['CF_Entre_Corp'],,Alberta,-117.469,52.28333
1262906034785525760,2020-05-20 00:40:37+00:00,womanatmile0,Twitter for iPhone,"['break', 'school', 'france', 'say', 'make', 'terrible', 'mistake', 'reopen', 'school', 'system', 'french', 'school', 'shut', 'back', 'today', 'covid-19', 'infection', 'child', 'reach', 'epidemic', 'proportion', 'happen', 'devos/trump', 'plan', 'open', 'back', 'america']","BREAKING - Schools in FRANCE said they made a TERRIBLE MISTAKE reopening their school system. FRENCH SCHOOLS SHUT BACK DOWN TODAY after COVID-19 infections in the children reach Epidemic proportions!

Is this what’ll happen UNDER THE DEVOS/TRUMP plan to OPEN BACK UP AMERICA?",True,0.0,0.0,,,['FrankSowa1'],Victoria,British Columbia,-123.3693,48.43294
1262906347953283074,2020-05-20 00:41:51+00:00,TinaM1992,Twitter for iPhone,"['temporary', 'relief', 'eces/daycare', 'worker', 'essentialworkers', 'steph_smith303', 'jjhorgan', 'carolejames', 'bcgovnews', 'bcgeu']","For the temporary relief pay, do ECE’s/daycare workers get it too? We are #EssentialWorkers too
 @steph_smith303 @jjhorgan @carolejames @BCGovNews @bcgeu 

https://t.co/0OdrpZ1dHh",False,1.0,0.0,['EssentialWorkers'],['https://twitter.com/i/web/status/1262906347953283074'],['steph_smith303'],,,-113.64258000000001,60.10867
1262906425233289216,2020-05-20 00:42:10+00:00,she_is_king,Twitter Web Client,"['email', 'child', 'school', '8:00', 'covid-19', 'crisis', 'mcsweeney', 'internet', 'tendency']",Emails from My Children’s School Before 8:00 AM During the COVID-19 Crisis - McSweeney’s Internet Tendency https://t.co/lYM8g1ux6d,False,0.0,0.0,,['https://www.mcsweeneys.net/articles/emails-from-my-childrens-school-before-8-00-am-during-the-covid-19-crisis'],,Toronto,Ontario,-79.4163,43.700109999999995
1262906751390810112,2020-05-20 00:43:27+00:00,nicmas2,Twitter for Android,"['fordnation', 'fact', '2014', '2018', 'child', '1-14', 'number', 'death', 'influenza', 'canada', 'range', 'since', 'child', 'die', 'coronavirus', 'common', 'significantly', 'dangerous', 'economy', 'shut', 'close', 'school']","@fordnation Here's some FACTS.....from 2014 to 2018, children 1-14 yrs old, the number of deaths from influenza in Canada ranged from 18 to 23. 
Since 0 children have died from Coronavirus, the common flu is SIGNIFICANTLY more dangerous.
Did the economy shut down? Did we close schools?",False,24.0,4.0,,['https://twitter.com/i/web/status/1262906751390810112'],['fordnation'],,,-113.64258000000001,60.10867
1262906888288645120,2020-05-20 00:44:00+00:00,ssplibraries,Twitter for iPhone,"['publisher', 'nosy', 'crow', 'quality', 'free', 'resource', 'post', 'website', 'also', 'copy', 'coronavirus', 'book', 'child', 'illustrate', 'axel', 'scheffler', 'digital', 'book', 'primary', 'school', 'child', 'free', 'anyone', 'read']","UK publisher, Nosy Crow, have some quality, free resources posted on their website.  You can also get a copy of “Coronavirus: A Book for Children” illustrated by Axel Scheffler, a digital book for primary school age children, free for anyone to read.
https://t.co/H9HSLBP5CI https://t.co/FPPkkYShsD",False,4.0,3.0,,['https://twitter.com/i/web/status/1262906888288645120'],,Lunenburg,Nova Scotia,-64.33466700000001,44.36504
1262909210393747464,2020-05-20 00:53:14+00:00,BruceHPlante,Twitter Web App,"['break', 'school', 'france', 'say', 'make', 'terrible', 'mistake', 'reopen', 'school', 'system', 'french', 'school', 'shut', 'back', 'today', 'covid-19', 'infection', 'child', 'reach', 'epidemic', 'proportion', 'happen', 'devos/trump', 'plan', 'open', 'back', 'america']","BREAKING - Schools in FRANCE said they made a TERRIBLE MISTAKE reopening their school system. FRENCH SCHOOLS SHUT BACK DOWN TODAY after COVID-19 infections in the children reach Epidemic proportions!

Is this what’ll happen UNDER THE DEVOS/TRUMP plan to OPEN BACK UP AMERICA?",True,0.0,0.0,,,['FrankSowa1'],,,-113.64258000000001,60.10867
1262909910913777669,2020-05-20 00:56:01+00:00,murphycurling,Twitter for iPhone,"['break', 'school', 'france', 'say', 'make', 'terrible', 'mistake', 'reopen', 'school', 'system', 'french', 'school', 'shut', 'back', 'today', 'covid-19', 'infection', 'child', 'reach', 'epidemic', 'proportion', 'happen', 'devos/trump', 'plan', 'open', 'back', 'america']","BREAKING - Schools in FRANCE said they made a TERRIBLE MISTAKE reopening their school system. FRENCH SCHOOLS SHUT BACK DOWN TODAY after COVID-19 infections in the children reach Epidemic proportions!

Is this what’ll happen UNDER THE DEVOS/TRUMP plan to OPEN BACK UP AMERICA?",True,0.0,0.0,,,['FrankSowa1'],,,-113.64258000000001,60.10867
1262910095228235776,2020-05-20 00:56:45+00:00,wrtruck13,Twitter for Android,"['fordnation', 'safe', 'child', 'abuse/molestations', 'increase', 'since', 'lockdown', 'honestly', 'think', 'keep', 'kid', 'safe', 'scar', 'life', 'crazy', 'think', 'keep', 'kid', 'safe', 'crazy', 'look', 'stats', 'police', 'endthelockdownnow', 'insanity', 'distress']","@fordnation SAFE?  Child abuse/molestations have INCREASED since this lockdown. You HONESTLY think you're keeping kids safe? You're SCARING THEM FOR LIFE. You're crazy to think you're keeping kids safe. Just CRAZY. Look at the stats, ask the police.

#endthelockdownnow 
#insanity 
#Distress",True,0.0,0.0,,,"['DJHutchinson2', 'fordnation']",Hamilton,Ontario,-79.84963,43.25011
1262911427771318272,2020-05-20 01:02:02+00:00,Mr_Pronovost,Twitter for iPhone,"['kathleen_wynne', 'also', 'need', 'plan', 'place', 'outline', 'emergency', 'procedure', 'school', 'case', 'covid', 'student', 'return', 'person', 'learning', 'also', 'need', 'plan', 'parent', 'might', 'suddenly', 'child', 'home', 'day', 'isolation']","@Kathleen_Wynne There also needs to be a plan in place that outlines the emergency procedures for schools that have cases of COVID 19, once students return to in person learning. There will also need to be a plan for parents who might suddenly have their children home for 14 days of isolation.",False,15.0,1.0,,['https://twitter.com/i/web/status/1262911427771318272'],['Kathleen_Wynne'],Hamilton,Ontario,-79.84963,43.25011
1262911580808925184,2020-05-20 01:02:39+00:00,ZachMakesTracks,Twitter Web App,"['call', 'kidshelpphone', 'double', 'since', 'covid-19', 'unsinkable', 'host', '60-minute', 'special', 'thank', 'young', 'people', 'do', 'keep', 'canadian', 'safe', 'healthy', 'true', 'family', 'event', 'miss', 'unsinkableyouth']",Calls to @KidsHelpPhone have doubled since COVID-19. @unsinkable is hosting a 60-minute @CTV special to thank young people for all they've done to keep Canadians safe and healthy. This is a true family event. Don't miss it. #UnsinkableYouth https://t.co/p8m1qcJRQ9,True,0.0,0.0,,,"['SilkenLaumann', 'KidsHelpPhone', 'unsinkable', 'CTV']",Hamilton,Ontario,-79.84963,43.25011
1262912438435041280,2020-05-20 01:06:03+00:00,SunnyVegas360,Twitter Web App,"['crepes78', 'ridge83243963', 'ctvtoronto', 'justintrudeau', 'covid', 'work', 'school']",@Crepes78 @Ridge83243963 @CTVToronto @JustinTrudeau What did your kid do before Covid? Did your kid go to work with you? School is 9-3.. do you have a job 9-3?,False,0.0,0.0,,['https://twitter.com/i/web/status/1262912438435041280'],"['Crepes78', 'Ridge83243963', 'CTVToronto', 'JustinTrudeau']",Toronto,Ontario,-79.4163,43.700109999999995
1262913659589795846,2020-05-20 01:10:54+00:00,CdnChange,CoSchedule,"['preschool', 'deaf', 'hard', 'hear', 'kid', 'face', 'imminent', 'closure', 'matthew', 'whose', '4-year-old', 'daughter', 'attend', 'preschool', 'fight', 'keep', 'open']","Preschools for deaf and hard of hearing kids are facing imminent closure. Matthew, whose 4-year-old daughter attends one of these preschools, is fighting to keep them open. https://t.co/tlBlGVlzOd",False,5.0,2.0,,['https://twitter.com/i/web/status/1262913659589795846'],,,,-113.64258000000001,60.10867
1262914756446470144,2020-05-20 01:15:16+00:00,jimandirina,Twitter for iPhone,"['break', 'school', 'france', 'say', 'make', 'terrible', 'mistake', 'reopen', 'school', 'system', 'french', 'school', 'shut', 'back', 'today', 'covid-19', 'infection', 'child', 'reach', 'epidemic', 'proportion', 'happen', 'devos/trump', 'plan', 'open', 'back', 'america']","BREAKING - Schools in FRANCE said they made a TERRIBLE MISTAKE reopening their school system. FRENCH SCHOOLS SHUT BACK DOWN TODAY after COVID-19 infections in the children reach Epidemic proportions!

Is this what’ll happen UNDER THE DEVOS/TRUMP plan to OPEN BACK UP AMERICA?",True,0.0,0.0,,,['FrankSowa1'],Vancouver,British Columbia,-123.11934,49.24966
1262915928800530437,2020-05-20 01:19:55+00:00,shannongalea,Twitter Web App,"['covid-19', 'change', 'child', 'youth', 'live', 'education', 'system', 'greatly', 'affected', 'call', 'support', 'include', 'at-home', 'back-to-school', 'learning', 'directive', 'province/territory', 'wesupportphe']","COVID-19 has changed the way that children and youth are living, and the education system has been greatly affected. We are calling for your support to include PHE in at-home and back-to-school learning directives in your province/territory. #WeSupportPHE

https://t.co/cjoJueFq4b https://t.co/x6hkXXFi8n",True,0.0,0.0,,,['PHECanada'],Montreal,Quebec,-73.58781,45.50884
