id,created_at,screen_name,source,clean_text,original_text,is_retweet,favorite_count,retweet_count,hashtags,urls,mentions,city,province,longitude,latitude
1252028447708164097,2020-04-20 00:16:58+00:00,KatrineConroy,Twitter for iPhone,"['thank', 'try', 'stop', 'covid', 'shout', 'healthcareheroes', 'child', 'woman', 'hospital', 'effort', 'keep', 'safe', 'covid19', 'flattenthecurve']",“Thank you for trying to stop the covid 19.” Shout out to all our #HealthCareHeroes at BC Children’s &amp; BC Women's hospitals for their efforts to keep us safe #COVID19 #FlattenTheCurve https://t.co/Z1rkVQM7ZU,True,0.0,0.0,['HealthCareHeroes'],,['BCChildrensHosp'],Castlegar,British Columbia,-117.66893999999999,49.29984
1252029813579108352,2020-04-20 00:22:23+00:00,kelloggmba2011,Twitter for iPhone,"['google', 'give', 'worker', 'eight', 'extra', 'week', 'pay', 'leave', 'take', 'care', 'family', 'coronavirus', 'outbreak', 'force', 'school', 'remain', 'closed']",Google is giving its workers eight extra weeks of paid leave to take care of their families as the coronavirus outbreak forces schools to remain closed https://t.co/zOGncLkGn4,True,0.0,0.0,,,['CNNBusiness'],Vancouver,British Columbia,-123.11934,49.24966
1252030845138976768,2020-04-20 00:26:29+00:00,JunaidMasood,Twitter for Android,"['_sweet_leah_', 'fordnation', 'emergency', 'service', 'employee', 'work', 'help', 'keep', 'community', 'safe', 'raise', 'family', 'try', 'bring', 'virus', 'home', 'criticize']",@_Sweet_Leah_ @fordnation I'm an emergency services employee working each day to help keep my community safe while raising a family and trying to not bring this virus home..  and not criticizing those who are doing what they can when they can.,True,0.0,0.0,,,"['911_please_hold', '_Sweet_Leah_', 'fordnation']",Toronto,Ontario,-79.4163,43.700109999999995
1252031973993873408,2020-04-20 00:30:58+00:00,SandraKMorin,Twitter for iPhone,"['google', 'give', 'worker', 'eight', 'extra', 'week', 'pay', 'leave', 'take', 'care', 'family', 'coronavirus', 'outbreak', 'force', 'school', 'remain', 'closed']",Google is giving its workers eight extra weeks of paid leave to take care of their families as the coronavirus outbreak forces schools to remain closed https://t.co/zOGncLkGn4,True,0.0,0.0,,,['CNNBusiness'],Montreal,Quebec,-73.58781,45.50884
1252033225259659265,2020-04-20 00:35:57+00:00,ewomanAfterDark,Twitter for Android,"['meakoopa', 'cult', 'catholic', 'mother', 'go', 'full', 'conspiracy', 'theory', 'email', 'child', 'email', 'address', 'know', 'quote', 'safe', 'virus', 'outside', 'hat']","@meakoopa My cult Catholic mother went full conspiracy theory and emailed all 7 of her children who have an email address to let us know and I quote ""we'll be safe from the virus outside, it Hates the Sun."" 😬",False,4.0,0.0,,['https://twitter.com/i/web/status/1252033225259659265'],['meakoopa'],,,-113.64258000000001,60.10867
1252033830703284226,2020-04-20 00:38:21+00:00,abreuvictoria13,Twitter Web App,"['justintrudeau', 'rcmpns', 'canadian', 'bear', 'toronto', 'suppose', 'start', 'full', 'time', 'family', 'virus', 'hold', 'someone', 'help', 'abreuvictoria2121', 'yahoocom', '416-388-9304', 'thank', 'trudeau:0', 'stay', 'healthy', 'safe']","@JustinTrudeau @RCMPNS I am Canadian, born in Toronto.
I was suppose to start a full time job in family law.

now this virus hit, and now its been put on hold.

I can't get my $2k , can you get someone to help me.

abreu.victoria2121@yahoo.com
416-388-9304

THANK YOU MR. TRUDEAU:0
STAY HEALTHY AND SAFE",False,0.0,0.0,,['https://twitter.com/i/web/status/1252033830703284226'],"['JustinTrudeau', 'RCMPNS']",,,-61.2,13.08333
1252035525646536706,2020-04-20 00:45:05+00:00,sjwoodgate,Twitter for Android,"['democratic', 'disease', 'people', 'assume', 'pandemic', 'democratically', 'equal', 'true', 'unfair', 'disease', 'housing', 'income', 'matter', 'learn', 'canadian', 'family', 'struggle', 'time']","'Not a democratic disease.' People assume that the pandemic is democratically equal. This is not true. It is an unfair disease where housing and income matters. 

Learn more about a Canadian family's struggle during these times.

https://t.co/BTHN2Cdcc8",False,11.0,3.0,,['https://twitter.com/i/web/status/1252035525646536706'],,Calgary,Alberta,-114.08528999999999,51.05011
1252037988248358913,2020-04-20 00:54:52+00:00,meadllar,Twitter for iPhone,"['especially', 'asymptomatic', 'carrier', 'unknowingly', 'pass', 'virus', 'vulnerable', 'high-risk', 'population', 'young', 'people', 'die', 'child', 'folk', 'many', 'pre-existing', 'condition', 'live', 'productive', 'life', 'decade', 'covid-19']","Especially asymptomatic carriers who unknowingly pass the virus to vulnerable high-risk populations. Young people are dying, children, folks in their 20s, 30s, 40s. Yes, many had pre-existing conditions, but they may have lived productive lives for decades if not for COVID-19.",True,0.0,0.0,,,['BillyCorben'],,,-113.64258000000001,60.10867
1252038017088274432,2020-04-20 00:54:59+00:00,DParent49883464,Twitter for iPhone,"['feel', 'risk', 'like', 'run', 'country', 'health', 'crisis', 'pandemic', 'work', 'chocolate', 'factory', 'deem', 'essential', 'every', 'risk', 'family', 'life', 'like', 'incompetent', 'fire']","You feel at risk by doing your Job
Like running the country during a health crisis and Pandemic
Why does my son have to work at a chocolate factory, deemed essential
Every day he risks his and his family’s life for the likes of your incompetent ass
Your fired https://t.co/9j3Ap1qrhe",False,0.0,0.0,,['https://twitter.com/i/web/status/1252038017088274432'],,Hamilton,Ontario,-79.84963,43.25011
1252042474891161600,2020-04-20 01:12:42+00:00,PJ_Hawtie,Twitter for Android,"['susandelacourt', 'maybe', 'station', 'agree', 'andrewscheer', 'evening', 'news', 'stop', 'put', 'people', 'life', 'risk', 'start', 'take', 'covid-19', 'seriously', 'infect', 'family']","@SusanDelacourt Maybe if we get TV stations to agree to put @AndrewScheer on the evening news he will stop putting people's lives at risk and start taking COVID-19 seriously!

What if he infects his own family?",True,0.0,0.0,,,"['winter_canada', 'SusanDelacourt', 'AndrewScheer']",Quebec,Quebec,-71.21454,46.81228
1252048218386464768,2020-04-20 01:35:31+00:00,DonnaGillis,Twitter for iPad,"['susandelacourt', 'maybe', 'station', 'agree', 'andrewscheer', 'evening', 'news', 'stop', 'put', 'people', 'life', 'risk', 'start', 'take', 'covid-19', 'seriously', 'infect', 'family']","@SusanDelacourt Maybe if we get TV stations to agree to put @AndrewScheer on the evening news he will stop putting people's lives at risk and start taking COVID-19 seriously!

What if he infects his own family?",True,0.0,0.0,,,"['winter_canada', 'SusanDelacourt', 'AndrewScheer']",,Nova Scotia,-62.99865,45.00015
1252048234844807168,2020-04-20 01:35:35+00:00,Vancityfan1,Twitter for iPhone,"['cris', 'cyborg', 'criscyborg', 'sell', 'covid-19', 'face', 'mask', 'benefit', 'at-risk', 'child', 'program', 'brazil', 'info']","Cris Cyborg (@criscyborg) is selling COVID-19 face masks to benefit at-risk children's programs in Brazil 

MORE INFO: https://t.co/7Mv9VsK2F4 https://t.co/9fgiwMRZ8u",True,0.0,0.0,,,"['FanSidedMMA', 'criscyborg']",Vancouver,British Columbia,-123.11934,49.24966
1252049298709262337,2020-04-20 01:39:49+00:00,JoanneCangal,Twitter for iPhone,"['susandelacourt', 'maybe', 'station', 'agree', 'andrewscheer', 'evening', 'news', 'stop', 'put', 'people', 'life', 'risk', 'start', 'take', 'covid-19', 'seriously', 'infect', 'family']","@SusanDelacourt Maybe if we get TV stations to agree to put @AndrewScheer on the evening news he will stop putting people's lives at risk and start taking COVID-19 seriously!

What if he infects his own family?",True,0.0,0.0,,,"['winter_canada', 'SusanDelacourt', 'AndrewScheer']",Toronto,Ontario,-79.4163,43.700109999999995
1252050616014299139,2020-04-20 01:45:03+00:00,leslie_la_lune,Twitter for Android,"['want', 'know', 'civil', 'liberty', 'back', 'justintrudeau', 'fordnation', 'child', 'pay', 'long', 'time', 'social', 'fiscal', 'debt', 'bear', 'backtoschool', 'backtoworknow', 'debt', 'insurmountable']",My son wants to know how he can get his civil liberties back @JustinTrudeau @fordnation our children are and will be paying a long time a social and fiscal debt that is not their's to bear. Let's get them #backtoschool and us #BackToWorkNOW before this debt is insurmountable,False,0.0,0.0,,['https://twitter.com/i/web/status/1252050616014299139'],"['JustinTrudeau', 'fordnation']",Hamilton,Ontario,-79.84963,43.25011
1252050647945535489,2020-04-20 01:45:11+00:00,lolaaugustine,Twitter for iPhone,"['panic', 'inability', 'keep', 'child', 'safe', 'lock', 'five', 'week', 'pandemic', 'today', 'lock', 'hour', 'mass-shooting', 'county', 'double', 'lock', 'guess', 'always', 'felt', 'protect', 'living', 'canada', 'world', 'awful', 'right']","Panicking at my inability to keep my children safe. Locked down for five weeks due to pandemic, today locked down for an hour because a mass-shooting in my county. Double locked down I guess. I always felt protected from it all living in Canada. The world is awful right now.",False,86.0,2.0,,['https://twitter.com/i/web/status/1252050647945535489'],,Truro,Nova Scotia,-63.308662,45.308031
1252050904489971712,2020-04-20 01:46:12+00:00,AaronWAnderson,Twitter for Android,"['listen', 'life', 'good', 'never', 'forget', 'need', 'fuck', 'deal', 'covid', 'together', 'live', 'smart', 'safe', 'country', 'husband', 'wive', 'mother', 'father', 'brother', 'sister', 'family', 'stay', 'strong']","Listen up. Life is good. Never forget that. We need to man the fuck up and deal with COVID together. We all have a lot to live for. Let's be smart and safe. As a country, as husband's, wive's, mother's, father's, brothers, sisters, as family. We got this. Stay strong.",True,0.0,0.0,,,['MikeyCannabis'],Vancouver,British Columbia,-123.11934,49.24966
1252051220576915456,2020-04-20 01:47:27+00:00,1loriking,Twitter for Android,"['susandelacourt', 'maybe', 'station', 'agree', 'andrewscheer', 'evening', 'news', 'stop', 'put', 'people', 'life', 'risk', 'start', 'take', 'covid-19', 'seriously', 'infect', 'family']","@SusanDelacourt Maybe if we get TV stations to agree to put @AndrewScheer on the evening news he will stop putting people's lives at risk and start taking COVID-19 seriously!

What if he infects his own family?",True,0.0,0.0,,,"['winter_canada', 'SusanDelacourt', 'AndrewScheer']",,,,
1252056531878756354,2020-04-20 02:08:33+00:00,JoshMatlow,Twitter for iPhone,"['rent', 'hike', 'global', 'pandemic', 'midtown', 'beloved', 'mabel', 'fable', 'child', 'bookstore', 'really', 'difficult', 'month', 'lovebot', 'steal', 'info', 'please', 'contact', 'action', 'gratitude', 'return']","Between a rent hike and a global pandemic, midtown’s beloved Mabel’s Fables children’s bookstore has had a really difficult few months. And now, their “Lovebot” has been stolen. If you have any info, please contact them. There’ll be no action other than gratitude for its return. https://t.co/uraXEdQFmp",False,129.0,55.0,,['https://twitter.com/i/web/status/1252056531878756354'],,Toronto,Ontario,-79.4163,43.700109999999995
1252056682819014663,2020-04-20 02:09:09+00:00,Vicki84262468,Twitter for iPhone,"['home', 'safe', 'place', 'kid', 'please', 'watch', 'video', 'covid19', 'lockdown', 'mean', 'child', 'live', 'home', 'abuse', 'child', 'question', 'thing', 'home', 'hard', 'lockdown', 'hard']","Home is not a safe place for all kids. Please watch this video on what #covid19 lockdown means for children living in homes with abuse. Ask children questions about how things are at home. As hard as this lockdown is for all of us, it is harder for them https://t.co/ZrfHKR2Mns https://t.co/IMrsWR1nnq",True,0.0,0.0,['covid19'],,['cvangeyn'],,,-113.64258000000001,60.10867
1252056966098300930,2020-04-20 02:10:17+00:00,cdnfan75,Twitter Web App,"['rent', 'hike', 'global', 'pandemic', 'midtown', 'beloved', 'mabel', 'fable', 'child', 'bookstore', 'really', 'difficult', 'month', 'lovebot', 'steal', 'info', 'please', 'contact', 'action', 'gratitude', 'return']","Between a rent hike and a global pandemic, midtown’s beloved Mabel’s Fables children’s bookstore has had a really difficult few months. And now, their “Lovebot” has been stolen. If you have any info, please contact them. There’ll be no action other than gratitude for its return. https://t.co/uraXEdQFmp",True,0.0,0.0,,,['JoshMatlow'],Toronto,Ontario,-79.4163,43.700109999999995
1252056978165284866,2020-04-20 02:10:20+00:00,MerHep,Twitter for iPhone,"['rent', 'hike', 'global', 'pandemic', 'midtown', 'beloved', 'mabel', 'fable', 'child', 'bookstore', 'really', 'difficult', 'month', 'lovebot', 'steal', 'info', 'please', 'contact', 'action', 'gratitude', 'return']","Between a rent hike and a global pandemic, midtown’s beloved Mabel’s Fables children’s bookstore has had a really difficult few months. And now, their “Lovebot” has been stolen. If you have any info, please contact them. There’ll be no action other than gratitude for its return. https://t.co/uraXEdQFmp",True,0.0,0.0,,,['JoshMatlow'],Toronto,Ontario,-79.4163,43.700109999999995
1252057236932907008,2020-04-20 02:11:22+00:00,AijaGreen,Twitter for Android,"['rent', 'hike', 'global', 'pandemic', 'midtown', 'beloved', 'mabel', 'fable', 'child', 'bookstore', 'really', 'difficult', 'month', 'lovebot', 'steal', 'info', 'please', 'contact', 'action', 'gratitude', 'return']","Between a rent hike and a global pandemic, midtown’s beloved Mabel’s Fables children’s bookstore has had a really difficult few months. And now, their “Lovebot” has been stolen. If you have any info, please contact them. There’ll be no action other than gratitude for its return. https://t.co/uraXEdQFmp",True,0.0,0.0,,,['JoshMatlow'],Toronto,Ontario,-79.4163,43.700109999999995
1252057463370776576,2020-04-20 02:12:16+00:00,nikmarks,Twitter for iPhone,"['rent', 'hike', 'global', 'pandemic', 'midtown', 'beloved', 'mabel', 'fable', 'child', 'bookstore', 'really', 'difficult', 'month', 'lovebot', 'steal', 'info', 'please', 'contact', 'action', 'gratitude', 'return']","Between a rent hike and a global pandemic, midtown’s beloved Mabel’s Fables children’s bookstore has had a really difficult few months. And now, their “Lovebot” has been stolen. If you have any info, please contact them. There’ll be no action other than gratitude for its return. https://t.co/uraXEdQFmp",True,0.0,0.0,,,['JoshMatlow'],,,42.5,11.5
1252058710433763329,2020-04-20 02:17:13+00:00,rachkmc,Twitter Web App,"['rent', 'hike', 'global', 'pandemic', 'midtown', 'beloved', 'mabel', 'fable', 'child', 'bookstore', 'really', 'difficult', 'month', 'lovebot', 'steal', 'info', 'please', 'contact', 'action', 'gratitude', 'return']","Between a rent hike and a global pandemic, midtown’s beloved Mabel’s Fables children’s bookstore has had a really difficult few months. And now, their “Lovebot” has been stolen. If you have any info, please contact them. There’ll be no action other than gratitude for its return. https://t.co/uraXEdQFmp",True,0.0,0.0,,,['JoshMatlow'],Toronto,Ontario,-79.4163,43.700109999999995
1252058956379365378,2020-04-20 02:18:11+00:00,ryanwright,Twitter for iPhone,"['kyleharrietha', 'andrew', 'scheer', 'put', 'ottawa', 'risk', 'include', 'family', 'outgoing', 'leader', 'put', 'wife', 'danger', 'photo', 'global', 'pandemic']",@KyleHarrietha Andrew Scheer is putting all of Ottawa at risk. Including my family. An outgoing leader putting me and my wife in danger for a photo op during a global pandemic.,False,4.0,4.0,,['https://twitter.com/i/web/status/1252058956379365378'],['KyleHarrietha'],Ottawa,Ontario,-75.69811999999999,45.41117
1252060413392490497,2020-04-20 02:23:59+00:00,lednaxo,Twitter Web App,"['somebody', 'please', 'explain', 'quebec', 'logic', 'deliberate', 'open', 'school', 'child', 'back', 'shortly', 'gain', 'resistance', 'virus', 'small', 'child', 'one', 'devastate']","Can somebody please explain Quebec’s logic when they deliberate opening schools for children back up shortly so they can gain a resistance to the virus, when small children aren’t the ones being devastated by it?",False,5.0,1.0,,['https://twitter.com/i/web/status/1252060413392490497'],,,,,
1252060688572469251,2020-04-20 02:25:04+00:00,normsworld,Twitter for iPhone,"['rent', 'hike', 'global', 'pandemic', 'midtown', 'beloved', 'mabel', 'fable', 'child', 'bookstore', 'really', 'difficult', 'month', 'lovebot', 'steal', 'info', 'please', 'contact', 'action', 'gratitude', 'return']","Between a rent hike and a global pandemic, midtown’s beloved Mabel’s Fables children’s bookstore has had a really difficult few months. And now, their “Lovebot” has been stolen. If you have any info, please contact them. There’ll be no action other than gratitude for its return. https://t.co/uraXEdQFmp",True,0.0,0.0,,,['JoshMatlow'],Toronto,Ontario,-79.4163,43.700109999999995
1252061067255185410,2020-04-20 02:26:35+00:00,charliejohn2013,Twitter for Android,"['rent', 'hike', 'global', 'pandemic', 'midtown', 'beloved', 'mabel', 'fable', 'child', 'bookstore', 'really', 'difficult', 'month', 'lovebot', 'steal', 'info', 'please', 'contact', 'action', 'gratitude', 'return']","Between a rent hike and a global pandemic, midtown’s beloved Mabel’s Fables children’s bookstore has had a really difficult few months. And now, their “Lovebot” has been stolen. If you have any info, please contact them. There’ll be no action other than gratitude for its return. https://t.co/uraXEdQFmp",True,0.0,0.0,,,['JoshMatlow'],Toronto,Ontario,-79.4163,43.700109999999995
1252061252999938048,2020-04-20 02:27:19+00:00,Debalap,Twitter for Android,"['kyleharrietha', 'andrew', 'scheer', 'put', 'ottawa', 'risk', 'include', 'family', 'outgoing', 'leader', 'put', 'wife', 'danger', 'photo', 'global', 'pandemic']",@KyleHarrietha Andrew Scheer is putting all of Ottawa at risk. Including my family. An outgoing leader putting me and my wife in danger for a photo op during a global pandemic.,True,0.0,0.0,,,"['ryanwright', 'KyleHarrietha']",Hamilton,Ontario,-79.84963,43.25011
1252061772862783489,2020-04-20 02:29:23+00:00,SeeJanie_tweet,Twitter for Android,"['rent', 'hike', 'global', 'pandemic', 'midtown', 'beloved', 'mabel', 'fable', 'child', 'bookstore', 'really', 'difficult', 'month', 'lovebot', 'steal', 'info', 'please', 'contact', 'action', 'gratitude', 'return']","Between a rent hike and a global pandemic, midtown’s beloved Mabel’s Fables children’s bookstore has had a really difficult few months. And now, their “Lovebot” has been stolen. If you have any info, please contact them. There’ll be no action other than gratitude for its return. https://t.co/uraXEdQFmp",True,0.0,0.0,,,['JoshMatlow'],Toronto,Ontario,-79.4163,43.700109999999995
1252062110043049984,2020-04-20 02:30:43+00:00,SherryBilenduke,Twitter for Android,"['rent', 'hike', 'global', 'pandemic', 'midtown', 'beloved', 'mabel', 'fable', 'child', 'bookstore', 'really', 'difficult', 'month', 'lovebot', 'steal', 'info', 'please', 'contact', 'action', 'gratitude', 'return']","Between a rent hike and a global pandemic, midtown’s beloved Mabel’s Fables children’s bookstore has had a really difficult few months. And now, their “Lovebot” has been stolen. If you have any info, please contact them. There’ll be no action other than gratitude for its return. https://t.co/uraXEdQFmp",True,0.0,0.0,,,['JoshMatlow'],Toronto,Ontario,-79.4163,43.700109999999995
1252062586872516609,2020-04-20 02:32:37+00:00,CanadaChildLife,Twitter for iPad,"['way', 'provide', 'sense', 'comfort', 'safety', 'protection', 'support', 'child', 'covid19', 'pandemic']","14 ways to provide a sense of comfort, safety, protection and support for children during the #COVID19 pandemic https://t.co/8Jic45JIUd",True,0.0,0.0,['COVID19'],,['rb_research'],,,-113.64258000000001,60.10867
1252066478112870402,2020-04-20 02:48:05+00:00,angela_smith77,Twitter for iPhone,"['rent', 'hike', 'global', 'pandemic', 'midtown', 'beloved', 'mabel', 'fable', 'child', 'bookstore', 'really', 'difficult', 'month', 'lovebot', 'steal', 'info', 'please', 'contact', 'action', 'gratitude', 'return']","Between a rent hike and a global pandemic, midtown’s beloved Mabel’s Fables children’s bookstore has had a really difficult few months. And now, their “Lovebot” has been stolen. If you have any info, please contact them. There’ll be no action other than gratitude for its return. https://t.co/uraXEdQFmp",True,0.0,0.0,,,['JoshMatlow'],Toronto,Ontario,-79.4163,43.700109999999995
1252066630407880704,2020-04-20 02:48:41+00:00,Aurorameansdawn,Twitter for iPhone,"['everyone', 'want', 'exit', 'coronavirus', 'crisis', 'return', 'wage', 'inequality', 'fat-cattery', 'anti-', 'worker', 'law', 'underfunded', 'public', 'service', 'child', 'poverty', 'queue', 'poor', 'housing', 'food', 'bank', 'unchecked', 'corporate', 'power', 'elective', 'dictatorship', 'thought']","Everyone wants to exit the coronavirus crisis, but return to what - low wages, inequalities, fat-cattery, anti- worker laws, underfunded public services, child poverty, NHS queues, poor housing, food banks, unchecked corporate power, elective dictatorships ...
Any thoughts?",True,0.0,0.0,,,['premnsikka'],,,-113.64258000000001,60.10867
1252067860714868740,2020-04-20 02:53:34+00:00,scottforde1,Twitter for Android,"['lose', 'provinical', 'jail', 'covid-19', 'maybe', 'social', 'distancing', 'charter', 'right', 'triumph', 'safety', 'life', 'staff', 'inmate', 'family', 'stop', 'gamble', 'life', 'sylviajones', 'cbcnews', 'ctvottawa']","So we've lost one provinical jail(OCI) to covid-19. We gonna maybe try some social distancing now or we gonna let some charter rights triumph over safety and lives of staff, inmate and family. Stop gambling with our lives now @sylviajones @CBCNews @ctvottawa",False,34.0,21.0,,['https://twitter.com/i/web/status/1252067860714868740'],,Hamilton,Ontario,-79.84963,43.25011
1252068221131411456,2020-04-20 02:55:00+00:00,TeslinMaria,Twitter Web App,"['thread', 'middle', 'class', 'indian', 'basically', 'sanghis', 'discussion', 'family', 'someone', 'mention', 'cop', 'thrash', 'people', 'rid', 'scooter', 'lockdown', 'wrong', 'illegal', 'say', 'follow', 'u_n_b_e_l_i_e_vable', 'tellya']","A thread.
Middle class Indians are basically #Sanghis. Was having a discussion with family on #WA. Someone mentioned that cops were thrashing people for riding 3 on a scooter during #Lockdown. That's wrong and illegal, I said. What followed was u_n_b_e_l_i_e_vable. Lemme tell'ya",True,0.0,0.0,"['Sanghis', 'WA']",,['GorwayGlobal'],Toronto,Ontario,-79.4163,43.700109999999995
1252072538060062720,2020-04-20 03:12:10+00:00,dupuisj,Twitter Web App,"['rent', 'hike', 'global', 'pandemic', 'midtown', 'beloved', 'mabel', 'fable', 'child', 'bookstore', 'really', 'difficult', 'month', 'lovebot', 'steal', 'info', 'please', 'contact', 'action', 'gratitude', 'return']","Between a rent hike and a global pandemic, midtown’s beloved Mabel’s Fables children’s bookstore has had a really difficult few months. And now, their “Lovebot” has been stolen. If you have any info, please contact them. There’ll be no action other than gratitude for its return. https://t.co/uraXEdQFmp",True,0.0,0.0,,,['JoshMatlow'],Toronto,Ontario,-79.4163,43.700109999999995
1252072692729155584,2020-04-20 03:12:46+00:00,FairbankBird101,Twitter Web App,"['rent', 'hike', 'global', 'pandemic', 'midtown', 'beloved', 'mabel', 'fable', 'child', 'bookstore', 'really', 'difficult', 'month', 'lovebot', 'steal', 'info', 'please', 'contact', 'action', 'gratitude', 'return']","Between a rent hike and a global pandemic, midtown’s beloved Mabel’s Fables children’s bookstore has had a really difficult few months. And now, their “Lovebot” has been stolen. If you have any info, please contact them. There’ll be no action other than gratitude for its return. https://t.co/uraXEdQFmp",True,0.0,0.0,,,['JoshMatlow'],Toronto,Ontario,-79.4163,43.700109999999995
1252076306344431616,2020-04-20 03:27:08+00:00,nattyroons,Twitter Web App,"['frank', 'family', 'hope', 'yall', 'awesome', 'monday', 'wonderful', 'stay', 'safe', 'healthy', 'bless', 'week', 'bless', 'family', 'club', 'family', 'passion', 'goal', 'love', 'mondayvibes', 'lockdown', 'staysafe', 'stayhealthy', 'ynwa', 'jft96', 'godblessyouall']","GM Frank N All My LFC Family
Hope Y'all Having A Awesome Monday
Have Wonderful Day,Stay Safe &amp; Healthy,A Blessed New Week&amp;God Bless You My LFC Family 
One Club,One Family,One Passion,One Goal,One Love♥️
#MONDAYVIBES
#LOCKDOWN
#STAYSAFE
#STAYHEALTHY
#YNWA 
#JFT96
#GODBLESSYOUALL https://t.co/0VCZ5wOmgz",False,3.0,0.0,,['https://twitter.com/i/web/status/1252076306344431616'],,,,,
1252081882033987585,2020-04-20 03:49:17+00:00,shanwham,Twitter for iPhone,"['lose', 'provinical', 'jail', 'covid-19', 'maybe', 'social', 'distancing', 'charter', 'right', 'triumph', 'safety', 'life', 'staff', 'inmate', 'family', 'stop', 'gamble', 'life', 'sylviajones', 'cbcnews', 'ctvottawa']","So we've lost one provinical jail(OCI) to covid-19. We gonna maybe try some social distancing now or we gonna let some charter rights triumph over safety and lives of staff, inmate and family. Stop gambling with our lives now @sylviajones @CBCNews @ctvottawa",True,0.0,0.0,,,['scottforde1'],Peterborough,Ontario,-78.31623,44.30012
