id,created_at,screen_name,source,clean_text,original_text,is_retweet,favorite_count,retweet_count,hashtags,urls,mentions,city,province,longitude,latitude
1295482147248254978,2020-08-17 22:06:27+00:00,LSPareja,Twitter for iPhone,"['today', 'ford', 'reveal', 'master', 'plan', 'elementary', 'intend', 'fund', 'safe', 'class', 'size', 'whatever', 'reductions', 'board', 'squeeze', 'reserve', 'expect', 'come', 'back', 'worker', 'attack', 'year', 'another', 'safeseptember']","Today, Ford revealed his master plan for elementary:

He doesn’t intend to fund safe class sizes. Whatever reductions the Boards can squeeze out of reserves are expected to come on the backs of the workers they attacked all year. 

There is another way to a #SafeSeptember 👇 https://t.co/8onpxGiZq1",True,0.0,0.0,,,['parentaction4ed'],,,-113.64258000000001,60.10867
1295482183164080141,2020-08-17 22:06:36+00:00,WiggyKris,Twitter for Android,"['strangrobert', 'expect', 'covid', 'resurgence', 'fall', 'zachchurchill', 'school', 'resume', 'normal', 'everyone', 'option', 'school', 'online', 'mitigate', 'spread', 'beforehand', 'zachchurchill', 'open', 'window', 'folks', 'hahaha']","@StrangRobert: we expect a covid resurgence in the fall.

@zachchurchill: school will resume as normal. 

Everyone: why are our only options all in school or all online? Shouldn't we try to mitigate spread beforehand?

@zachchurchill: open the windows folks hahaha!",False,0.0,0.0,,['https://twitter.com/i/web/status/1295482183164080141'],"['StrangRobert', 'zachchurchill']",Halifax,Nova Scotia,-63.572390000000006,44.64533
1295482197063983105,2020-08-17 22:06:39+00:00,bronwen70,Twitter for iPad,"['today', 'ford', 'reveal', 'master', 'plan', 'elementary', 'intend', 'fund', 'safe', 'class', 'size', 'whatever', 'reductions', 'board', 'squeeze', 'reserve', 'expect', 'come', 'back', 'worker', 'attack', 'year', 'another', 'safeseptember']","Today, Ford revealed his master plan for elementary:

He doesn’t intend to fund safe class sizes. Whatever reductions the Boards can squeeze out of reserves are expected to come on the backs of the workers they attacked all year. 

There is another way to a #SafeSeptember 👇 https://t.co/8onpxGiZq1",True,0.0,0.0,,,['parentaction4ed'],Toronto,Ontario,-79.4163,43.700109999999995
1295482216672137216,2020-08-17 22:06:44+00:00,Brenda6614,Twitter Web App,"['alberta', 'student', 'family', 'understand', 'school', 'need', 'spread', 'staff', 'keep', 'everyone', 'safe', 'adrianalagrange', 'need', 'keep', 'promise', 'rehire', '20000', 'staff', 'lay', 'spring', 'abed', 'safeseptember']","Alberta students and families understand that schools need to spread out and staff up to keep everyone safe. @AdrianaLaGrange needs to keep her promise and rehire the 20,000 staff she laid off in the spring. #abed #SafeSeptember https://t.co/qp308fLtXT",True,0.0,0.0,,,['shoffmanAB'],,Alberta,-117.469,52.28333
1295482286658527232,2020-08-17 22:07:00+00:00,jgreen0751,Twitter for iPad,"['baffle', 'folk', 'claim', 'doug', 'ford', 'show', 'great', 'leadership', 'safeseptember', 'plan', 'evade', 'responsibility', 'blame', 'others', 'flaw', 'create', 'divisive', 'tone', 'try', 'turn', 'public', 'teacher', 'exact', 'opposite', 'good', 'leadership']","I’m baffled by folks who claim Doug Ford is ‘showing great leadership’.
Re. his #SafeSeptember plan, he's evading responsibility, blaming others for its flaws, &amp; creating a divisive tone by trying to turn the public against teachers.
This is the exact opposite of good leadership.",True,0.0,0.0,['SafeSeptember'],,['jwbrown556'],Hamilton,Ontario,-79.84963,43.25011
1295482326483435520,2020-08-17 22:07:10+00:00,ToriLRidgewood,Twitter for iPhone,"['today', 'bring', 'school', 'queen', 'park', 'show', 'ford', 'unsafeseptember', 'scheme', 'leave', 'kid', 'elbow-to-elbow', 'september', 'premier', 'fund', 'smallersaferclasses', 'hire', 'staff', 'would', 'cross', 'finger', 'take', 'action', 'make', 'kid', 'safe']","Today, I brought a school bus to Queen’s Park to show how Ford's #UnsafeSeptember scheme will leave kids elbow-to-elbow in September.
If I were premier, I’d be funding #SmallerSaferClasses by hiring more staff. I wouldn’t just cross my fingers — I’d take action to make kids safe. https://t.co/bp3xH8hRlv",True,0.0,0.0,['UnsafeSeptember'],,['AndreaHorwath'],,,-113.64258000000001,60.10867
1295482334293221377,2020-08-17 22:07:12+00:00,McLennan1977,Twitter Web App,"['baffle', 'folk', 'claim', 'doug', 'ford', 'show', 'great', 'leadership', 'safeseptember', 'plan', 'evade', 'responsibility', 'blame', 'others', 'flaw', 'create', 'divisive', 'tone', 'try', 'turn', 'public', 'teacher', 'exact', 'opposite', 'good', 'leadership']","I’m baffled by folks who claim Doug Ford is ‘showing great leadership’.
Re. his #SafeSeptember plan, he's evading responsibility, blaming others for its flaws, &amp; creating a divisive tone by trying to turn the public against teachers.
This is the exact opposite of good leadership.",True,0.0,0.0,['SafeSeptember'],,['jwbrown556'],Windsor,Ontario,-83.01654,42.30008
1295482404669476871,2020-08-17 22:07:28+00:00,bleasdalefamily,Twitter for iPhone,"['politician', 'busy', 'nbelection', 'focus', 'covid19', 'pandemic', 'safe', 'return', 'school', 'student', 'teacher', 'brunswick', 'parent', 'maddening', 'nbpoli']",When politicians are too busy with #NBElection to focus on the #COVID19 pandemic and a safe return to schools for students and teachers in New Brunswick. As a parent this is so maddening!! #nbpoli https://t.co/dOA5uI7jTB,False,1.0,0.0,"['NBElection', 'COVID19']",['https://twitter.com/i/web/status/1295482404669476871'],,,New Brunswick,-65.99878000000001,46.5001
1295482504007364614,2020-08-17 22:07:52+00:00,k_jkathen70,Twitter for Android,"['baffle', 'folk', 'claim', 'doug', 'ford', 'show', 'great', 'leadership', 'safeseptember', 'plan', 'evade', 'responsibility', 'blame', 'others', 'flaw', 'create', 'divisive', 'tone', 'try', 'turn', 'public', 'teacher', 'exact', 'opposite', 'good', 'leadership']","I’m baffled by folks who claim Doug Ford is ‘showing great leadership’.
Re. his #SafeSeptember plan, he's evading responsibility, blaming others for its flaws, &amp; creating a divisive tone by trying to turn the public against teachers.
This is the exact opposite of good leadership.",True,0.0,0.0,['SafeSeptember'],,['jwbrown556'],Windsor,Ontario,-83.01654,42.30008
1295482517647171585,2020-08-17 22:07:55+00:00,GucciardiElisa,Twitter Web App,"['today', 'ford', 'reveal', 'master', 'plan', 'elementary', 'intend', 'fund', 'safe', 'class', 'size', 'whatever', 'reductions', 'board', 'squeeze', 'reserve', 'expect', 'come', 'back', 'worker', 'attack', 'year', 'another', 'safeseptember']","Today, Ford revealed his master plan for elementary:

He doesn’t intend to fund safe class sizes. Whatever reductions the Boards can squeeze out of reserves are expected to come on the backs of the workers they attacked all year. 

There is another way to a #SafeSeptember 👇 https://t.co/8onpxGiZq1",True,0.0,0.0,,,['parentaction4ed'],Hamilton,Ontario,-79.84963,43.25011
1295482759515955202,2020-08-17 22:08:53+00:00,adaroundtown,Twitter for iPhone,"['take', 'ford', 'late', 'rejection', 'tdsb', 'plan', 'best', 'within', 'constraint', 'comment', 'prep', 'time', 'today', 'ford', 'clearly', 'communicate', 'expect', 'worker', 'mostly', 'woman', 'cost', 'pandemic', 'public', 'safeseptember']","Our take on Ford’s latest:

👉With the rejection of TDSB plan that did its best within constraints, &amp; his comments about prep time today, Ford has clearly communicated that he expects ed workers, who are mostly women, to pay the cost of the pandemic in public ed.

#SafeSeptember https://t.co/Ri0vnM8qJC",True,0.0,0.0,,,['parentaction4ed'],Toronto,Ontario,-79.4163,43.700109999999995
1295482808887115776,2020-08-17 22:09:05+00:00,maureen_oesch,Twitter for Android,"['time', 'oectaprov', 'say', 'member', 'fordnation', 'sflecce', 'stop', 'make', 'outrageous', 'statement', 'insult', 'incredible', 'professional', 'teach', 'school', 'safeseptember', 'focus', 'distraction', 'unsafeseptember', 'plan']",At no time has @OECTAProv said this to our members! @fordnation  and @Sflecce  should stop making outrageous statements and  insulting the incredible professionals who teach in our schools! #SafeSeptember should be the focus not this distraction from their #UnsafeSeptember plan https://t.co/1U3eCF9tBO,True,0.0,0.0,,,"['OECTAprez', 'OECTAProv', 'fordnation', 'Sflecce']",Guelph,Ontario,-80.24967,43.5501
1295482828491239425,2020-08-17 22:09:09+00:00,pamelafrogers,Twitter Web App,"['happen', 'wake', 'sflecce', 'week', 'august', 'school', 'reopening', 'plan', 'mess', 'bipoc', 'family', 'impact', 'sflecce', 'shoddy', 'planning', 'safeseptember', 'onted', 'onpoli', 'leadershipmatters']",What happened to “woke” @Sflecce ? 3rd week of August and school reopening plan is a mess. BIPOC Ss and families will be impacted by @Sflecce shoddy planning  #Safeseptember #onted #onpoli #LeadershipMatters,True,0.0,0.0,,,"['DrAnnLopez', 'Sflecce']",Ottawa,Ontario,-75.69811999999999,45.41117
1295482844555276288,2020-08-17 22:09:13+00:00,jumba68,Twitter for Android,"['pediatrician', 'write', 'minister', 'gordwyant', 'urge', 'come', 'robust', 'backtoschool2020', 'plan', 'hear', 'concerned', 'parent', 'teacher', 'education', 'worker', 'daily', 'afraid', 'yesterday', 'announcement', 'little', 'late', 'sasked', 'skpoli', 'covid19sk']","37 SK Pediatricians wrote to Ed Minister @GordWyant urging him to come up with a robust #BackToSchool2020 plan. I hear from concerned parents, teachers, and education workers daily &amp; I'm afraid yesterday's announcement is too little too late. #sasked #skpoli #covid19sk https://t.co/NwZAkV279k",True,0.0,0.0,['BackToSchool2020'],,"['Vicki_Mowat_NDP', 'GordWyant']",,Saskatchewan,-106.00098999999999,54.0001
1295482893326843907,2020-08-17 22:09:25+00:00,lonergse,Twitter for iPhone,"['ctvtoronto', 'fordnation', 'consult', 'teacher', 'driver', 'release', 'plan', 'problem', 'face', 'sflecce', 'everyone', 'deserve', 'safe', 'class', 'size', 'limit', 'student', 'allow', 'distance', 'covid19ontario', 'safeseptember', 'backtoschool2020']",@CTVToronto @fordnation didn’t consult with teachers or bus drivers before releasing their plan.  Any problems he faces are on him and @Sflecce now. Everyone deserves to be safe. Class sizes limited to 15 students allows distancing. #COVID19Ontario #SafeSeptember #BackToSchool2020,True,0.0,0.0,,,"['ccleighton', 'CTVToronto', 'fordnation']",Greater Napanee,Ontario,-76.94944,44.25012
1295482905549058049,2020-08-17 22:09:28+00:00,catonclass,Twitter for Android,"['really', 'glad', 'tdsb', 'get', 'much', 'support', 'plan', 'much', 'safer', 'let', 'forget', 'board', 'need', 'advocate', 'measure', 'kid', 'deserve', 'safe', 'unsafeseptember', 'colindmello', 'meyer_lucas', 'etfoeducators']","I'm really glad that @tdsb is getting so much support for a plan that is so much safer, but lets not forget the other boards. We need to advocate for the same measures there too. ALL kids deserve to be safe.

#UnsafeSeptember

@ColinDMello 
@meyer_lucas 
@ETFOeducators",False,6.0,0.0,,['https://twitter.com/i/web/status/1295482905549058049'],['tdsb'],Brampton,Ontario,-79.76633000000001,43.683409999999995
1295482991008002048,2020-08-17 22:09:48+00:00,michaeljrspeers,Twitter for iPhone,"['take', 'ford', 'late', 'rejection', 'tdsb', 'plan', 'best', 'within', 'constraint', 'comment', 'prep', 'time', 'today', 'ford', 'clearly', 'communicate', 'expect', 'worker', 'mostly', 'woman', 'cost', 'pandemic', 'public', 'safeseptember']","Our take on Ford’s latest:

👉With the rejection of TDSB plan that did its best within constraints, &amp; his comments about prep time today, Ford has clearly communicated that he expects ed workers, who are mostly women, to pay the cost of the pandemic in public ed.

#SafeSeptember https://t.co/Ri0vnM8qJC",True,0.0,0.0,,,['parentaction4ed'],Barrie,Ontario,-79.66634,44.40011
1295483106535907335,2020-08-17 22:10:16+00:00,McLennan1977,Twitter Web App,"['frustrate', 'upset', 'take', 'action', 'surj', 'run', 'phone', 'register', 'help', 'fight', 'safeseptember']",Frustrated? Upset? You can take action! SURJ is running a phone zap! Register &amp; help fight for #SafeSeptember!! https://t.co/eoHfcXHGjm,True,0.0,0.0,['SafeSeptember'],,['parentaction4ed'],Windsor,Ontario,-83.01654,42.30008
1295483143525412869,2020-08-17 22:10:24+00:00,catonclass,Twitter for Android,"['baffle', 'folk', 'claim', 'doug', 'ford', 'show', 'great', 'leadership', 'safeseptember', 'plan', 'evade', 'responsibility', 'blame', 'others', 'flaw', 'create', 'divisive', 'tone', 'try', 'turn', 'public', 'teacher', 'exact', 'opposite', 'good', 'leadership']","I’m baffled by folks who claim Doug Ford is ‘showing great leadership’.
Re. his #SafeSeptember plan, he's evading responsibility, blaming others for its flaws, &amp; creating a divisive tone by trying to turn the public against teachers.
This is the exact opposite of good leadership.",True,0.0,0.0,['SafeSeptember'],,['jwbrown556'],Brampton,Ontario,-79.76633000000001,43.683409999999995
1295483234738941952,2020-08-17 22:10:46+00:00,DonleavyLin,Twitter Web App,"['infuriate', 'listen', 'ford', 'blame', 'teacher', 'failure', 'ensure', 'kid', 'return', 'safe', 'small', 'class', 'september', 'like', 'ask', 'someone', 'else', 'premier', 'make', 'decision', 'need', 'make', 'around', 'safeseptember', 'onted', 'onpoli']","It is infuriating to listen to Ford blame teachers for his own failure to ensure that kids return to safe, small classes in September

It’s like he’s asking someone else to be premier &amp; make the decisions we need made around here 🤦🏽‍♀️

#SafeSeptember #onted #onpoli",True,0.0,0.0,,,['beyrima'],Toronto,Ontario,-79.4163,43.700109999999995
1295483956947824640,2020-08-17 22:13:38+00:00,maureen_oesch,Twitter for Android,"['tylerwhat16', 'exist', 'fordnation', 'sflecce', 'little', 'mind', 'dream', 'privatization', 'crumble', 'public', 'school', 'system', 'try', 'last', 'year', 'reach', 'use', 'pandemic', 'health', 'life', 'child', 'agenda']","@tylerwhat16 It exists in @fordnation and @Sflecce 's little minds that are dreaming of privatization and a crumbling public school system... they tried this last year too. They have just reached a new low and are using a pandemic AND the health and lives of children, to further their agenda",False,1.0,0.0,,['https://twitter.com/i/web/status/1295483956947824640'],"['tylerwhat16', 'fordnation', 'Sflecce']",Guelph,Ontario,-80.24967,43.5501
1295484264658550784,2020-08-17 22:14:52+00:00,HGanshorn,Twitter Web App,"['important', 'read', 'lot', 'people', 'momentarily', 'exercise', 'issue', 'covid-19', 'safety', 'picture', 'need', 'build', 'strong', 'public', 'school', 'system', 'support', 'child', 'future']","An important read. Lots of people are momentarily exercised about this issue because of COVID-19 and safety, but the big picture is that we need to build a strong public school system that supports all children into the future. https://t.co/J3b1eaUTuY",False,1.0,0.0,,['https://twitter.com/i/web/status/1295484264658550784'],,Calgary,Alberta,-114.08528999999999,51.05011
1295484283755339776,2020-08-17 22:14:56+00:00,maureen_oesch,Twitter for Android,"['week', 'away', 'many', 'return', 'school', 'plan', 'still', 'flux', 'need', 'give', 'parent', 'time', 'good', 'understand', 'local', 'plan', 'make', 'decision', 'return', 'school', 'safeseptember']",We’re only a few weeks away and many return to school plans are still in flux. We need to give parents more time to better understand their local plan and make the decision to return to school. #SafeSeptember https://t.co/8VSG6NsoBr,True,0.0,0.0,,,['StephenBlais'],Guelph,Ontario,-80.24967,43.5501
1295484288574660611,2020-08-17 22:14:57+00:00,RT1925,Twitter for Android,"['pandemic', 'really', 'highlighting', 'wealth', 'disparity', 'dual', 'class', 'society', 'live', 'friend', 'toronto', 'say', 'private', 'school', 'limit', 'kid', 'class', 'social', 'bubble', 'public', 'school', 'politician', 'fine', 'class', 'kid', 'onpoli']","The pandemic is really highlighting wealth disparities in the dual class society we live in.

Friend in Toronto said his kid's new private school is limited to 10 kids per class, each a social bubble.

Public school? Politicians are fine with classes having 30+ kids. 

#onpoli",True,0.0,0.0,,,['StephenPunwasi'],Pembroke,Ontario,-77.11616,45.81681
1295484303116296193,2020-08-17 22:15:01+00:00,jeffreyawhiteca,Twitter for iPhone,"['happen', 'wake', 'sflecce', 'week', 'august', 'school', 'reopening', 'plan', 'mess', 'bipoc', 'family', 'impact', 'sflecce', 'shoddy', 'planning', 'safeseptember', 'onted', 'onpoli', 'leadershipmatters']",What happened to “woke” @Sflecce ? 3rd week of August and school reopening plan is a mess. BIPOC Ss and families will be impacted by @Sflecce shoddy planning  #Safeseptember #onted #onpoli #LeadershipMatters,True,0.0,0.0,,,"['DrAnnLopez', 'Sflecce']",Toronto,Ontario,-79.4163,43.700109999999995
1295484311102267392,2020-08-17 22:15:03+00:00,maureen_oesch,Twitter for Android,"['happen', 'tomorrow', 'demand', 'safeseptember', 'student']",Happening tomorrow! Demand a #SafeSeptember for all students! https://t.co/2tRdGuWIjC,True,0.0,0.0,['SafeSeptember'],,['SURJto'],Guelph,Ontario,-80.24967,43.5501
1295484564324978691,2020-08-17 22:16:03+00:00,LizWelsh65,Twitter for iPad,"['provincial', 'funding', 'half-billion', 'dollar', 'fact', 'zero', 'provincial', 'dollar', 'allocate', 'fund', 'public', 'school', 'ontario', 'sflecce', 'perform', 'late', 'sleight', 'hand', 'unlock', '500-million', 'onted', 'onpoli', 'safeseptember']","New provincial funding of a half-billion dollars? In fact, ZERO NEW PROVINCIAL DOLLARS WERE ALLOCATED TO FUNDING PUBLIC ED &amp; SCHOOLS IN #ONTARIO when @Sflecce performed his latest sleight of hand &amp; “unlocked” $500-million. #onted #onpoli #safeSeptember https://t.co/kwNmVO0pE8.",True,0.0,0.0,,,['Fix_Our_Schools'],Petrolia,Ontario,-82.14981,42.86678
1295484575955726337,2020-08-17 22:16:06+00:00,Twihard59,Twitter for Android,"['colindmello', 'tell', 'good', 'teacher', 'resign', 'truly', 'incompetent', 'firelecce', 'fordnation', 'unsafeseptember', 'people', 'room', 'solution']","@ColinDMello Tell him that he has no good Will with the teachers and that he should resign. He is truly incompetent. #firelecce @fordnation  #UnsafeSeptember
32 people in one room is not a solution.",True,0.0,0.0,,,"['NormalOntario', 'ColinDMello']",,,-113.64258000000001,60.10867
1295484665978134529,2020-08-17 22:16:27+00:00,MsB_ELL,Twitter for iPhone,"['sflecce', 'everyone', 'except', 'unsafeseptember', 'fails', 'student', 'education', 'staff', 'parent', 'welcome', 'frontline', 'teach', 'staff', 'first', 'school', 'mess', 'create', 'firelecce']","@Sflecce Everyone is EXCEPT you! Your #UnsafeSeptember fails students, education staff and parents. I welcome you to be one of the frontline teaching staff on the first day of school to see the mess you have created. #FireLecce",False,30.0,3.0,['UnsafeSeptember'],['https://twitter.com/i/web/status/1295484665978134529'],['Sflecce'],Markham,Ontario,-79.2663,43.866820000000004
1295484763642433538,2020-08-17 22:16:51+00:00,alearraiz,Twitter for iPhone,"['join', 'next', 'tuesday', '12-1pm', 'demand', 'safe', 'equitable', 'well-resourced', 'september', 'every', 'student', 'family', 'education', 'worker', 'register', 'safeseptemberon', 'safeseptember']","Join us again next Tuesday, Aug 18, 12-1pm to demand a safe, equitable, and well-resourced September for every student, family, and education worker!

Register:
https://t.co/3gFvoeobRK

#SafeSeptemberON #SafeSeptember https://t.co/1y5SFR4u2u",True,0.0,0.0,,,['SURJto'],Toronto,Ontario,-79.4163,43.700109999999995
1295484891845427200,2020-08-17 22:17:21+00:00,jchvmn,Twitter for Android,"['score', 'alberta', 'teacher', 'educational', 'assistant', 'come', 'forward', 'ready', 'willing', 'help', 'make', 'school', 'safe', 'covid-19', 'pandemic', 'lack', 'funding', 'leave', 'sideline', 'thread', 'abed', 'ableg', 'safeseptember']","Scores of Alberta teachers and educational assistants have come forward to say they’re ready and willing to help make schools safe during the COVID-19 pandemic, but lack of funding from the UCP has left them on the sidelines.

THREAD #abed #ableg #safeseptember",True,0.0,0.0,,,['RachelNotley'],,,-113.64258000000001,60.10867
1295485016772878344,2020-08-17 22:17:51+00:00,AmarTechie,Twitter for iPhone,"['europe', 'mess', 'around', 'hopefully', 'fordnation', 'take', 'playbook', 'someday', 'near', 'future', 'safeseptember']",Europe don’t mess around - hopefully @fordnation doesn’t take out this playbook someday in the near future #SafeSeptember 😷 https://t.co/MLqG8ddT09,False,0.0,0.0,,['https://twitter.com/i/web/status/1295485016772878344'],['fordnation'],Hamilton,Ontario,-79.84963,43.25011
1295485119738781696,2020-08-17 22:18:16+00:00,Wilkinson4BC,Twitter Web App,"['lack', 'clarity', 'around', 'education', 'plan', 'create', 'anxiety', 'every', 'corner', 'must', 'ensure', 'child', 'family', 'prepared', 'face', 'challenge', 'covid-19', 'parent', 'deserve', 'choice', 'stability', 'safety', 'child', 'education']","The lack of clarity around the NDP's education plan is creating anxiety in every corner of B.C.

We must ensure our children &amp; families are prepared to face the challenges of COVID-19.

Parents deserve choice, stability, &amp; safety for their children's education. https://t.co/EUDIXdbKHa",False,24.0,21.0,,['https://twitter.com/i/web/status/1295485119738781696'],,Vancouver,British Columbia,-123.11934,49.24966
1295485169646747648,2020-08-17 22:18:28+00:00,Corbin_KelleyBC,Twitter for iPhone,"['lack', 'clarity', 'around', 'education', 'plan', 'create', 'anxiety', 'every', 'corner', 'must', 'ensure', 'child', 'family', 'prepared', 'face', 'challenge', 'covid-19', 'parent', 'deserve', 'choice', 'stability', 'safety', 'child', 'education']","The lack of clarity around the NDP's education plan is creating anxiety in every corner of B.C.

We must ensure our children &amp; families are prepared to face the challenges of COVID-19.

Parents deserve choice, stability, &amp; safety for their children's education. https://t.co/EUDIXdbKHa",True,0.0,0.0,,,['Wilkinson4BC'],Kamloops,British Columbia,-120.3192,50.66648
1295485175912992768,2020-08-17 22:18:29+00:00,shoffmanAB,Twitter Web App,"['safety', 'must', 'priority', 'present', 'ableg', 'plan', 're-opening', 'safe', 'school', 'successful', 'student', 'plan', 'contain', 'recommendation', 'keep', 'student', 'staff', 'community', 'safe', 'abed', 'safeseptember']","Safety must be the top priority. We presented #ableg with a plan for re-opening, Safe Schools, Successful Students. The plan contains 15 recommendations to keep students, staff and the community safe. #abed #safeseptember https://t.co/539yxU1VRm https://t.co/pNJxvSFLFZ",False,50.0,14.0,['ableg'],['https://twitter.com/i/web/status/1295485175912992768'],,Edmonton,Alberta,-113.46871000000002,53.55014
1295485258385719302,2020-08-17 22:18:49+00:00,BevAzevedo,Twitter for iPhone,"['doug', 'ford', 'true', 'colour', 'come', 'health', 'safety', 'well', 'child', 'screw', 'teacher', 'etfo', 'osstf', 'etfo', 'onted', 'cdnpoli', 'fordnation', 'sflecce', 'chuddles11', 'mini_bubbly', 'onpoli', 'covid19', 'coronavirus']","Doug Fords true colours have come out. It’s not about the health and safety and well being of our children, it’s about screwing the teachers. https://t.co/c3K1Hj2zqR @etfo @osstf @etfo #onted #cdnpoli @fordnation @Sflecce @chuddles11 @mini_bubbly #onpoli #COVID19 #coronavirus",False,31.0,16.0,,['https://twitter.com/i/web/status/1295485258385719302'],,,,-113.64258000000001,60.10867
1295485302249676800,2020-08-17 22:18:59+00:00,NBeesax,Twitter for iPhone,"['safety', 'must', 'priority', 'present', 'ableg', 'plan', 're-opening', 'safe', 'school', 'successful', 'student', 'plan', 'contain', 'recommendation', 'keep', 'student', 'staff', 'community', 'safe', 'abed', 'safeseptember']","Safety must be the top priority. We presented #ableg with a plan for re-opening, Safe Schools, Successful Students. The plan contains 15 recommendations to keep students, staff and the community safe. #abed #safeseptember https://t.co/539yxU1VRm https://t.co/pNJxvSFLFZ",True,0.0,0.0,['ableg'],,['shoffmanAB'],,,-113.64258000000001,60.10867
1295485357149097984,2020-08-17 22:19:12+00:00,BonnieNorthGP,Twitter for iPad,"['fordnation', 'jjhorgan', 'jkenney', 'substitute', 'teacher', 'go', 'school', 'even', 'class', 'class', 'covid19']","Hey @fordnation @jjhorgan
@jkenney what about substitute teachers going from https://t.co/JTVeORCx2j school or even class to class? #COVID19
https://t.co/x9wTH368iU",True,0.0,0.0,,['http://school.to'],"['MerlinofCanada', 'fordnation', 'jjhorgan', 'jkenney']",Barrie,Ontario,-79.66634,44.40011
1295485360479318022,2020-08-17 22:19:13+00:00,Ravenesque_2,Twitter Web App,"['attempt', 'return', 'child', 'classroom', 'fall', 'turn', 'slow-motion', 'train', 'wreck', 'least', '2400', 'student', 'staff', 'either', 'infect', 'covid-19', 'self-isolating', 'exposure']","The U.S. attempt to return children to the classroom this fall has turned into a slow-motion train wreck, with at least 2,400 students and staff either infected with COVID-19 or self-isolating because of exposure. https://t.co/6gzDuIFpcu",True,0.0,0.0,,,['ABCPolitics'],Kingston,Ontario,-76.48098,44.22976
